id,category,headline,short_description
1434,2,15 Habits That Could Be Hurting Your Business Relationships,"While everyone wants to appear confident and capable, odd verbal tics and off-putting body language can jeopardize your chances"
1435,3,Poor Cybersecurity Choices Spawned Today's Current Events,"As former FBI Director James Comey prepares to testify before Congress this week, it is worth reflecting about how poor cybersecurity"
1436,3,Hate Autoplay Videos? New Mac OS Will Let You Block Them On Safari.,Apple's announcement drew a cheer from the crowd at a conference Monday.
1437,2,9 Things Successful People Won't Do,"My last post, How Successful People Stay Calm, really struck a nerve. The trick is that managing your emotions is as much"
1438,2,We Need Innovation On How To Innovate,Let’s go to Denmark. The tiny little fairytale country in calm and quite Scandinavia. When a small country like that suddenly
1439,2,How Successful People Stay Calm,The ability to manage your emotions and remain calm under pressure has a direct link to your performance.
1440,2,Why Modern Work Is So Boring,We have collectively chosen to make work pay more rather than be more interesting.
1441,2,Mylan May Have Overcharged U.S. For EpiPen By $1.27 Billion,The amount is nearly three times a proposed settlement that the company announced in October.
1442,2,The Friendship Clause,Who has experienced a moment in their lives where something happened that forever changed the course of their career? Like
1443,2,6 Things That Always Go On Sale In June,Cue the back-to-school savings.
1444,2,6 Ways To Score Shopping Deals When You Left All Your Coupons At Home,There’s a reason you have a smartphone.
1445,2,Exxon Shareholders Push Company To Be More Transparent About Climate Risks,"Meanwhile, President Donald Trump reportedly plans to pull the U.S. out of the historic Paris climate pact."
1446,2,3 Ways To Test For Cultural Fit At Your Next Interview,Some things can’t quite be measured by a sterling resumé and perfect answers to standard job interview questions. More and
1447,3,Uber Fires Self-Driving Car Chief At Center Of Court Case,Anthony Levandowski is at the center of a legal battle between Uber and Waymo.
1448,2,An Open Letter To Brokers,"I come in peace. I have been hard on you in the past. At times, I was insensitive to the fact that you are husbands, wives"
1449,2,How Much Time Do You Waste In Meetings?,"Meetings can be effective tools for entrepreneurs, but only if you use them effectively. Meetings are designed to gather"
1450,2,The Rise Of Autonomous Cars May Mean The Fall Of Ridesharers,Ridesharers’ success today and possible misfortune tomorrow has a proximate cause: they don’t own their fleets.
1451,2,"Whether You're A Business Or Building A Personal Brand, 3 Reasons Why You Absolutely Need A Mission Statement","A large percentage of companies, including most of the Fortune 500, have corporate mission statements. According to Randell"
1452,3,Mother Of Uber CEO Killed In Boating Accident,The CEO’s father was being treated at an area hospital for what was described as moderate injuries.
1453,2,6 Summer Scams And How To Avoid Them,"As the weather gets warmer, mosquitos and ticks re-enter our lives, and along with them comes their larger cousin, the scam"
1454,2,"Britain's Growing Bookmaking Industry, And The Challenges Ahead","While the spectre of Brexit continues to impact on the UK, there are some national industries that are continuing to thrive"
1455,2,5 Lessons From Big Business That I’ve Gladly Taken Home,"Major corporations get a bad rap, in the media and online. It's not hard to understand why - as in so many other things, the"
1456,2,How Being An Immigrant Helped Me Become A Better CEO,"America is known as a land of not just opportunity, but also as a center of entrepreneurial innovation and a magnet for talent"
1457,2,The 3 Ways In Which Strategic Influence Is Different for Women,By: Miriam Grobman After almost four years of thinking about advancing women's leadership and talking to hundreds individuals
1458,2,Uber Vows To Repay NYC Drivers 'Tens Of Millions' After Tax Snafu,The company says it miscalculated its commission for several years.
1459,2,Expert Conversation: 'The Right To Luxury Could Constitute A Legitimate Claim',Luxury exists in most human societies throughout the world but in different forms. Gratisography/Pexels  Léa Barreau
1460,2,10 Behaviors That Highlight Your Leadership Ability,"Based on my years of experience as a new business advisor, I always find leadership to be more important to business success"
1461,2,Leave This At Home When You Go Shopping (Or You'll Regret It),What should you leave at home when you go shopping this summer? Jennifer Boaro prefers this strategy: Put your credit cards
1462,2,Marchinonne's Bet Against History,The news that Fiat-Chrysler is the latest auto-maker caught having massively – and probably illegally – exceeded allowable
1463,2,10 Habits Of Super Likeable Leaders,"If you want to be a leader whom people follow with absolute conviction, you have to be a likeable leader. Tyrants and curmudgeons"
1464,2,"Woman Awarded $100,000 For Starbucks Coffee Burns","Joanne Mogavero suffered first- and second-degree burns after coffee spilled on her lap, her lawyers say."
1465,2,10 Things That Set The Best Bosses Apart,They're grateful.
1466,2,Wall Street Is Starting To Panic About Trump,Stocks dropped 1.8 percent Wednesday.
1467,2,"Why Janitors Get Noncompete Agreements, Too","States are considering banning noncompete agreements for certain groups of workers, such as low-wage workers, teenagers and"
1468,3,Researchers See Possible North Korea Link To Global Cyber Attack,The attacks are among the fastest-spreading extortion campaigns on record.
1469,2,The Tech Giant Suing Uber Is Taking Its Technology To Lyft,Waymo has accused Uber of stealing its work on self-driving vehicles.
1470,2,6 Things You Should Never Say During An Interview,Now go land that dream job.
1471,3,The Global Cyberattack And The Need To Revisit Health Care Cybersecurity,The personal health data of 30 million Americans has been compromised since 2009.
1472,2,5 Points To Consider When Negotiating Your Salary,Rarely will an employer rescind an offer due to you negotiating.
1473,2,12 Daily Habits Of Exceptional Leaders,One of the most popular Dilbert comic strips in the cartoon’s history begins with Dilbert’s boss relaying senior leadership’s
1474,2,6 Honest Mistakes That Can Get You Fired,"There are so many things that can get good, hard-working people fired. Honest mistakes often carry hard-hitting consequences"
1475,3,Global Cyber Attack Eases Due To One Researcher's Quick Thinking,"Schools and hospitals were among those targeted, and attacks ramped up this week."
1476,2,8 Powerful Habits Of Profoundly Influential People,"Influential people have a profound impact on everyone they encounter. Yet, they achieve this only because they exert so much"
1477,2,"In A Win For Waymo, Judge Rules Uber Lawsuit Will Go To Trial",Uber had sought a private resolution by arbitration.
1478,3,Protect Your Inbox From Phishing And Other Email Attacks,"While we can’t guarantee your safety, these precautions will certainly minimize your risk."
1479,2,4 Business Mistakes I'll Never Make Again,This is your marathon ― not sprint ― moment.
1480,2,Navigating Emotional Labor At Work,"There is a generally-unspoken, but well-understood rule of the workplace: keep your emotions, unless they are positive, tightly"
1481,2,Emotional Literacy Is As Simple As Reading The Room,What’s wrong? This two-word question can summarily improve a brand. Think about it: the inquiry shows an interest in how
1482,3,The Internet Of Things Needs A Code Of Ethics,"As is often the case, the technology has developed far faster than policies and regulations."
1483,2,"Crayola Unveils True-Blue Crayon, And You Get The Chance To Name It",But will it ever help us forget Dandelion yellow?
1484,2,Uber's Self-Driving Program At Risk As Judge Considers Heated Case Brought By Rival,"Despite ample evidence, Waymo so far lacks a ""smoking gun,"" the judge said."
1485,2,Family Says They Were Forced Off Overbooked Delta Flight Over Child's Seat,The Schear family of Southern California says they were threatened with jail time and having their kids taken away.
1486,2,5 Tricks To Make Your Identity Portfolio More Secure,"I’ve written extensively about the importance of building a credit portfolio. Credit equals buying power, which, when used"
1487,2,"Uber Is In Court Today, Fighting For Its Very Existence",The future of the company's self-driving unit hangs on the judge's decision.
1488,2,Facebook Hires Thousands To Review Posts After Rash Of Live-Streamed Violence,"An additional 3,000 people will help filter content on the social network."
1489,2,Pay Raise For Workers; Jobs For Unemployed,"America needs a pay raise. Now. How we treat the least in society reflects our values. As a nation, we need to ask ourselves"
1490,3,Massive Tinder Photo Grab Is Latest Scary Warning To Be Careful What You Post,"Stealth sweeper says he'll use 40,000 photos for female and male facial recognition training for artificial intelligence."
1491,2,Delta Under Fire After Pilot Appears To Hit Passenger,"The company has defended the employee, who it said was breaking up a fight."
1492,2,Is There Any Way To Stop Ad Creep?,"By Mark Bartholomew, University at Buffalo, The State University of New York Ethics lawyers and historians have argued that"
1493,2,Delta Air Lines…Did We Not Learn Anything From The United Debacle?,"As an Atlanta resident, I LOVE Delta Airlines. As a corporate trainer however, I cringe at some of their recent leadership"
1494,2,How To Find Your Voice As A Leader And Speak Your Mind,"Chances are that as children, Donald Trump, Hillary Clinton, and Barack Obama watched and admired a parent or another close"
1495,2,Head Of Uber's Self-Driving Car Effort Steps Down,Anthony Levandowski moves to a different job at the company as a lawsuit filed by rival Waymo heads for trial.
1496,3,Facebook Says It Will Ramp Up Fight Against Propaganda,Facebook acknowledged that it has become a battleground for governments seeking to manipulate public opinion in other countries.
1497,2,Facebook's New Anti-Fake News Strategy Is Not Going To Work – But Something Else Might,"""Fake news"" = propaganda"
1498,2,Read This Before Calling Your Boss A 'Nasty Motherf**ker',"It's protected, but only in certain cases."
1499,2,Uber Says It Will Start Offering Flying Taxis In 2020,Uber says the vehicles will be quiet and have zero operational emissions.
1500,2,Waymo Is Quietly Winning The Self-Driving Car Race,"While Uber was talking, the Google spin-off was rolling."
1501,3,UPDATE: Fitbit Denies Claim Woman's Device Exploded,"Testing on the fitness tracker found that it sustained external damage, the company said in a statement."
1502,2,Chobani Sues Alex Jones For Posting Vicious Fake News Stories,The yogurt company says the falsified reports led to customers' calls to boycott their products.
1503,2,What If Uber Is A Joke?,"While Uber’s impact on the taxi industry is clearly not a joke, the market valuation of the company may well be."
1504,3,"Encrypted Chat Took Over. Let’s Encrypt Calls, Too","By Lily Hay Newman for WIRED. As end-to-end encrypted messaging apps have exploded in popularity, several well-known services"
1505,3,The Rise Of AR Will Recreate Your Filter Bubbles In The Real World,"By Cade Metz for WIRED. Last week, Mark Zuckerberg unveiled what he calls the world’s first augmented reality platform, a"
1506,3,Amazon Is Making It Easier For Companies To Track You,"By Adrienne LaFrance Like “big data” and “social media” before it, the term “artificial intelligence” has become so buzzworthy"
1507,3,Ad-Blocking Just Might Save The Ad Industry,"By Klint Finley for WIRED. The Coalition for Better Ads, a consortium of ad, publishing, and tech companies, wants to save"
1508,2,How To Get A Raise Without Asking For One,"We all want to get ahead. Still, even when it seems you’re doing everything right—you’re never late to work, rarely take"
1509,2,How 'Cool Syndrome' Is Killing Our Careers,A version of this post was originally posted on Forbes. Sign up for Caroline’s newsletter to get her articles sent straight
1510,2,American Airlines Suspends Worker After Ugly Confrontation In Which A Mom Was Allegedly Hit In The Face,"Video shows the employee challenging a passenger to ""c’mon, hit me."""
1511,2,Trump Is Even Less Popular Than United Airlines,But both are pretty unpopular right now.
1512,2,"San Francisco Power Outage Hits 90,000, Business District Affected",Officials said an incident at a San Francisco substation caused the outage.
1513,2,United CEO Oscar Munoz Thought He Would Be Chairman. Not Anymore.,The company also missed a deadline to explain why a passenger was violently removed from a flight.
1514,2,Why Tax Collection Scams Are Getting Harder To Stop,Leave it to our friends in Washington to take a bad situation and make it worse.
1515,3,I Still Have So Many Questions About This Juicero Thing!,"LOL @ this IRL episode of ""Silicon Valley."""
1516,3,Cleveland Killing Prompts Facebook To Review Handling Of Violent Posts,The accused killer's shocking video stayed online for about two hours.
1517,2,New York City Might Force Uber To Allow In-App Tipping For Drivers,"""It’s just not possible to make it on straight UberX rates."""
1518,3,5 Steps Every Victim Of Revenge Porn Should Consider,"Non-consensual pornography or ""revenge porn"" can be eliminated right now."
1519,2,Using The United Fiasco To Flourish In The Future,How many “experts” does it take to offer commentary and advice on a customer service catastrophe? The apparent answer is
1520,3,"Facebook Cracks Down On 30,000 Fake News Accounts Ahead of French Election",The social media company is taking out full-page newspaper ads with tips for spotting untrustworthy sites.
1521,3,Google Searches For 'World War 3' And 'Trump War' Hit All Time High,"Online searches for ""going to war"" are also spiking."
1522,2,2 Companies Intervene To Block Their Drugs In 'Assembly Line' Arkansas Executions,"Use of the drugs in the planned seven executions ""runs counter to manufacturers' mission to save lives,"" the firms say."
1523,2,United Airlines: Protecting The Company Instead Of Its Customers,"At this point, it would be hard to find someone who has not seen the horrifying video footage of police officers forcibly"
1524,2,United Airlines Wants YOU To Be Its Next Public Relations Manager,"""Being part of big, transformative moments like this are rare,"" the company says."
1525,3,"Uber Targeted Rival Lyft Drivers With ""Hell"" Program, Report Finds","""If true, these allegations are very concerning,"" Lyft said."
1526,2,"David Dao, Dragged United Passenger, Suffered Broken Nose, Missing Teeth, Lawyer Says","""Are we gonna continue being treated like cattle?"" attorney Thomas Demetrio said Thursday."
1527,2,Trump’s Tax Giveaway To Wall Street Is Shameful,"Under Trump’s plan, tax-dodging banks would pay even less."
1528,3,"Uber, Reeling From Controversies, Loses Another Executive",Uber's head of communications leaves as the bad publicity piles up.
1529,2,UA 3411: On Being A Randomly Picked Asian,"In America, when a source of authority says it randomly singles you out, you should always be wary."
1530,2,"When Companies Serve Their Customers Too Well, Nobody Wins. But You Can.","Is it possible for a company to be too good? Can a business outperform its competitors, spoil its customers, dominate the"
1531,2,Civic-Minded Construction: Paying It Forward,"The U.S. Construction industry is a $1.73 trillion industry. Its more than 700,000 companies account for over 7 million American"
1532,2,Feds Investigating Forcible Ejection Of Passenger On United Flight,"Airlines are required to have ""fair boarding"" procedures, a Department of Transportation statement says."
1533,2,Donald Trump's New York Modeling Agency To Shut Down,The company has been accused of booking jobs for immigrants without obtaining proper work visas.
1534,2,Read The Full Text Of United CEO's Controversial Letter To Employees,"""Our agents were left with no choice."""
1535,2,The Savings And Stability Of Public Banking,There needs to be much more education of state legislators and the public at large.
1536,2,Risking Your Life For Corporate Camaraderie,"Imagine being submerged inside a downed aircraft in icy water, knowing that to reach air and safety you have to work with"
1537,2,The Best Ways For Freelancers To Communicate With Clients,"As a freelancer, you must have a solid system in place for communicating with clients. Without this, you’ll find it difficult"
1538,2,Passengers Aren’t The Priority For United Airlines,The airline's tone-deaf public relations response to its most recent controversy demonstrates disregard for customers.
1539,2,Wells Fargo Execs Behind Sham Account Scandal Forced To Pay Millions Back To Company,"The bank is set to take back over $180 million in forfeitures, clawbacks and compensation adjustments."
1540,2,"“I’m Sorry""--The Two Tragically Forgotten Words In Customer Service","Unfortunately, I was one of those frustrated passengers caught in the midst of the recent spring break travel nightmare that"
1541,3,How Facebook is Responding to Fake News,"People want to see accurate information on Facebook and across the web. As a response, Facebook just launched a new educational"
1542,2,It’s Not Always Better To Do It Yourself,"The self-checkout machines that permeate grocery, home improvement and big box stores are a customer and worker’s worst nightmare"
1543,2,U.S. Labor Department Accuses Google of 'Significant' Gender Pay Gap,"Company discrimination is ""quite extreme, even in this industry."""
1544,2,9 Telltale Signs That It's Time To Quit Your Job,Choosing to leave a job can be a gut-wrenching decision. You need to know that you’re making the right choice.
1545,2,"Job Growth Cools, Unemployment Rate Falls To 4.5 Percent",Job growth slowed sharply in March amid continued layoffs in the retail sector.
1546,3,Facebook Releases New Tools To Combat Revenge Porn,"""It’s wrong, it’s hurtful, and if you report it to us, we will now use AI and image recognition to prevent it from being shared across all of our platforms."""
1547,2,9 Bad Manager Mistakes That Make Good People Quit,"If you want your best people to stay, you need to think carefully about how you treat them."
1548,3,SpaceX Launches And Lands The First Recycled Orbital Rocket Ever,"It's cool because with reusable rockets, space flight could get cheaper."
1549,2,Uber Resumes Self-Driving Car Program In San Francisco After Crash,"Uber’s San Francisco program is currently in development mode. It has two cars registered with the California Department of Motor Vehicles, but is not transporting passengers."
1550,2,Legal Battle Revs Up Over Marketing Defective Used Cars As 'Safe',"In essence, the concern is that buyers will have a false sense of security."
1551,2,Flexibility Will Close The Women’s Leadership Gap,We remain grossly underrepresented in nearly every industry.
1552,2,Uber Halts Self-Driving Car Fleet After Crash In Arizona,No one was injured when an SUV flipped on its side in Tempe.
1553,2,United Airlines Defends Right To Block Girls In Leggings,"The young passengers had to follow a dress code because they were traveling as guests of employees, the company said."
1554,2,8 Stupid Office Rules That Drive Everyone Crazy,Companies need to have rules—that’s a given—but they don’t have to be shortsighted and lazy attempts at creating order. I
1555,2,"Trump Says Charter To Invest $25 Billion In U.S., Hire 20,000 Workers",Much of the announcement was not new
1556,3,Can Silicon Valley Be The Heartbeat Of Technology For Good?,"Will technological revolution result in a safer and better world, or a more dangerous one?"
1557,2,Uber Board Stands By Embattled CEO,"Despite an unending string of controversy, Travis Kalanick's job is secure, a board member told reporters on a conference call."
1558,3,How The Rise Of Electronics Has Made Smuggling Bombs Easier,"By Kaveh Waddell Last February, a Somali man boarded a Daallo Airlines flight in Mogadishu, Somalia’s capital. Twenty minutes"
1559,2,Slump In Financials Sends Wall St. Lower,"“Republicans should have prioritized tax reform ahead of healthcare reform."""
1560,2,"In The Age Of Laissez Faire Regulation, The Ground Is Shifting Under Consumers. Here's What It Means.","If the recent news from Washington isn’t a little unsettling, maybe you should look again. A new administration has brought"
1561,3,Don’t Blame The Batteries For Every Lithium-Ion Explosion,By Tim Moynihan for WIRED. Lithium-ion batteries have been making headlines for all the wrong reasons. The latest marquee
1562,2,Uber President Jeff Jones Quits Amid Company Controversies,The company's No. 2 executive resigned after just six months on the job.
1563,3,"Yahoo Cyber Indictment Shows Kremlin, Hackers Working Hand-in-hand",A U.S. intelligence official said employing criminal hackers helps “complement Kremlin intentions and provide plausible deniability for the Russian state.”
1564,2,"Someone Copied The Wrong Person On An Email, And It Just Might Destroy Uber",It's Uber versus Google in a tale of corporate intrigue.
1565,2,9 Brands That Should Delete Their Account After That Tweet,We all make terrible Twitter mistakes. But these are egregious.
1566,3,"Hackers Attack High-Profile Twitter Accounts, Post Swastikas And Pro-Erdogan Content","Amnesty International, Duke University and Forbes were among the verified accounts affected by the hack."
1567,2,"High-Paying Job Listings Are Written To Attract Men, Study Finds",Another reason there aren't enough women at the top.
1568,3,Recharging Hoverboard Blamed For Toddler's Death In Home Fire,The 3-year-old girl is the first fatality in the U.S. linked to the notorious battery problem.
1569,2,When Is Regulation Excessive?,What matters is whether the objectives of regulation are being achieved.
1570,2,Nike Middle East's Badass New Ad Breaks Barriers And Defies Stereotypes,One of the most empowering things a woman can do for another woman is inspire her to come into herself and take charge of
1571,2,New Research Shows That We're Wired To Take The Path Of Least Resistance,We can't keep taking the easy way out.
1572,2,"Higher Interest Rates – Oh, Goodie!",Loose money and financial deregulation are not a good combination.
1573,2,Volkswagen Pleads Guilty In U.S. Court In Diesel Emissions Scandal,"""VW AG is pleading guilty to all three counts because it is guilty on all three counts.”"
1574,3,"TechBargains Weekly Deals: Smart Sprinklers, TurboTax And The Best Deal On A North Face Laptop Bag",Welcome to TechBargains Weekly deals where they find the best deals of the week to save you time and money. Act fast as stock
1575,2,China Moves To Approve At Least 35 Trump Trademarks,The approvals underline the complexities and potential concerns over conflicts of interest facing the president.
1576,2,Electronics Store RadioShack Files For Bankruptcy Again,"RadioShack will close approximately 200 stores and will evaluate options on the remaining 1,300."
1577,3,Apple Has Already Patched Many Of The WikiLeaks Exploits,"Well, that didn't take long."
1578,3,Snapchat's Marie Curie Filter Includes Makeup And People Aren't Happy,"""Someone should tell Snapchat that Marie Curie didn't have a smoky eye. But she did win a Nobel Prize twice."""
1579,3,Hackers Shaking Down Pennsylvania Democrats and U.S. Progressive Groups,Computers are infected with ransomware and attackers seek Bitcoin payoffs. Signs again point to Russia.
1580,2,Snap Shares Tumble As Short Sellers Move In,It's ugly.
1581,2,Uber Has A Secret Program Called 'Greyball' It Uses To Evade Police,"""I'm not sure there's anything illegal about it,"" a law professor told HuffPost."
1582,2,Bay Area School Gets Rich Quick On Snapchat Investment,"""God's looking out for us,"" a former president of the Catholic high school said."
1583,2,NBCUniversal Invested $500 Million In Snap Inc As Part Of IPO,"“With the Snap investment, we have invested over $1.5 billion in promising digital businesses in the last eighteen months.”"
1584,2,Snap's Shares Pop After $3.4 Billion IPO,The owner of the popular disappearing-message app has a market value of roughly $24 billion.
1585,3,FCC Blocks Rules That Required Broadband Providers To Offer Better Protection Of Customers' Data,Internet service providers hailed the decision. Consumer advocates objected.
1586,2,Yahoo's Marissa Mayer Loses Bonus For Handling Of 'Security Incident',About 500 million Yahoo users' accounts may have been compromised in the 2014 hacking.
1587,3,"Elon Musk, Before He Was Famous","We know, we know, Elon Musk is basically the brilliant Bruce Wayne like billionaire the world needs right now. He is a"
1588,2,"In A 1991 Film, Shell Oil Issued A Stark Warning About Climate Change Risks",And much of it has proved to be true.
1589,2,Snap Tops Expectations In Pricing Of Long-Awaited IPO,Snap Inc holds the richest valuation in a U.S. tech IPO since Facebook in 2012.
1590,3,Twitter Inches Forward In Fight Against Abuse,Sometimes Twitter eggs hatch into monsters.
1591,3,Facebook Prioritizes What Makes You 'Sad' Or 'Angry' Over What You 'Like',Think before you react.
1592,2,"If You Have One Of These Toys In Your House, You May Want To Stop Using It","More than 800,000 users are affected."
