id,category,headline,short_description
965,4,Two Journalism Schools Rescind Awards For Charlie Rose Amid Harassment Reports,"“The actions victimized young women much like those who make up the overwhelming majority of [our] students,"" wrote one dean."
966,1,Tennis Star Andy Murray Mercilessly Mocks Donald Trump Over Time Magazine Claim,"""This tweet is perfection."""
967,4,The Daily Mail's Erroneous Tweet On London Shooting Report Sparks Anger,"The U.K. paper says it ""deeply regrets"" the error."
968,4,Chef On 'Today' Goes Rogue And Puts Mayo In The Mashed Potatoes,Welcome to Thanksgiving in Trump's America.
969,2,Hundreds Of Europe's Amazon Workers Plan Black Friday Strike,The walkout threatens profits on one of the biggest shopping days of the year.
970,3,"Justin Trudeau, Other World Leaders Praise Net Neutrality Ahead Of FCC's Planned Repeal","Scrapping current regulations “does not make sense,"" the Canadian prime minister said Wednesday."
971,2,"24,000 Uber Drivers May Lose Their Side Hustle",Uber is truly a fascinating company. The 8-year-old firm is at once the source of strategy and business model admiration
972,4,Gayle King Further Addresses Charlie Rose Allegations,"""When you think about the anguish of those women ... you have to report the news."""
973,4,Katy Tur Has A 'Brutal Question' For Trump Over His Support For 'Accused Pedophile',The NBC host called out the president over his statements on Roy Moore.
974,4,"Peter Thiel Wants To Buy Gawker, New Court Filing Suggests",It would give him the power to delete the shuttered site's entire archive.
975,1,Ball: Good Or Bad For Black Fathers?,The detention of LiAngelo Ball and his two UCLA basketball teammates and Trump’s tout of his role in getting them released
976,4,Fox News Contributor Says Pence's Dining Rules Are 'Ahead Of His Time',"In a world rife with sexual harassment, how better to keep workplaces safe for women?"
977,2,Why The Hotel Industry Is Fighting Proposals To Give Housekeepers Panic Buttons,"Despite tales of sexual harassment and assault, the leading industry lobby sees the devices as a ""fig leaf"" and a ""solution in search of a problem."""
978,4,"Transcript, Emails Show How Tabloid Reporters Helped Harvey Weinstein Get Dirt On Women",A closer look at how a journalist coaxed a movie producer into providing negative information on a potential Weinstein accuser.
979,3,Amazon Launches 'Secret' Cloud Service For Intelligence Agencies,Amazon Web Services Secret Region expands after some troubling cloud security screwups.
980,4,'CBS This Morning' Hosts Address Charlie Rose Allegations,"""There is no excuse for this alleged behavior,"" co-host Norah O'Donnell said."
981,2,Surprise Bidder For Weinstein Company Wants Embattled Studio To Be Led By Women,Former Obama official and businesswoman Maria Contreras-Sweet has reportedly submitted an offer to acquire TWC for $275 million.
982,4,"CBS, PBS Cut Ties With Charlie Rose Following Sexual Misconduct Allegations",At least a dozen women have accused Rose of unwanted sexual harassment.
983,1,FIFA On Trial: Qatar’s World Cup Back In The Firing Line,By James M. Dorsey Testimony of a star witness in a New York courtroom has revealed new allegations of Qatari wrongdoing
984,4,Sarah Sanders Asks Press To Say What They're Thankful For Before Questions,"“I hope you felt the passion of my thankfulness,"" April Ryan said."
985,4,Megyn Kelly: It's Time To 'Get Comfortable' Holding Powerful Men Accountable,"The TV host opened up about her experience with Charlie Rose, the veteran journalist accused of sexual harassment."
986,2,"Uber Paid Hackers $100,000 To Keep A Massive Data Breach Quiet",The hack affected 57 million people.
987,4,Sean Hannity Gets Brutally Rejected By Attorney For Moore Accuser,"""Lazy"" Fox News host slammed: “Not known for journalistic integrity.”"
988,2,The Ultimate Roundup For Hundreds Of Black Friday Deals,"Your one-stop-shop for all things Black Friday -- from beauty and fashion, to tech and home deals."
989,2,Did You Know Trump Made It Easier For Banks To Get Away With Screwing The Poor And Minorities?,"Let’s start by talking about Republican economic philosophy. To be sure, popular vote loser Donald Trump has not played a"
990,4,Writer Calls On Women Of Color 'To Divest From Lena Dunham' After Controversy,"Author Zinzi Clemmons said she would no longer contribute to Dunham's Lenny Letter after the ""Girls"" creator defended a writer on the show accused of rape."
991,4,Charlie Rose Accused Of Sexually Harassing And Groping Women,Eight women say the talk show host made unwanted advances toward them.
992,4,Alabama Media Group Rejects Cease-And-Desist Order From Roy Moore — With A Warning,A lawsuit could hurt more than help.
993,3,Apple Black Friday Deals That Are Actually Worth Your Time And Money,The wait is over.
994,4,The New York Times Has Suspended Glenn Thrush Amid Sexual Misconduct Claims,"A Vox reporter detailed how ""scared, violated, angry"" she and other women felt after interactions with Thrush."
995,4,Finding News In The Noise,It’s time to wake up to this very simple realization: Fake news won’t fix itself. Our information ecosystem is awash in garbage
996,2,'He Was Masturbating… I Felt Like Crying': What Housekeepers Endure To Clean Hotel Rooms,Low-wage workers have been fighting sexual harassment for years. The national conversation is finally catching up with them.
997,4,My Story: TED And Sexual Harassment,It’s no surprise that so many have been sharing their experiences. Over the past month Harvey Weinstein and Kevin Spacey
998,1,NFL Investigating Jameis Winston After Uber Driver Says The Quarterback Groped Her,The Tampa Bay player previously faced a civil suit over rape allegations.
999,1,Women's Basketball Team Declined Trump's White House Invitation For The Best Reason,Burrrrrn 🔥
1000,4,Jim Bakker Claims 'Merry Christmas' Was Outlawed,"Televangelist fires a new salvo in the ""War on Christmas."""
1001,4,Twitter Now Revoking Verified Profiles That Break Its New Rules,A number of high-profile white nationalists have lost their blue check marks.
1002,2,"Verizon, Comcast Approach 21st Century Fox About Acquiring Assets",The assets were the subject of recent talks between Fox and Walt Disney Co.
1003,2,"All Of The Best Black Friday Deals, In One Exhaustive List","Check back, because we'll keep updating this list as the deals roll in 💸"
1004,4,Hannity Drops Roy Moore Ultimatum After Senate Nominee Writes Letter,"""We demanded, rightly, answers ... . He provided them."""
1005,3,Here's How To Get Free 2-Day Shipping On Your Black Friday Purchases,"Move over, Amazon 👋"
1006,1,NFL Reporter Levels Troll With Hard-Earned Comeback,Score one for Stacey Dales.
1007,3,Here's Where To Get The Best Black Friday Deal On An XBox One,"For hobbyist gamers, the Xbox One S is a wallet-friendly choice 🎮"
1008,4,"Shep Smith Breaks From Fox News Coverage, Tears ‘Uranium One’ Scandal To Shreds","Since the segment, Uranium One has been mentioned over 40 times on various Fox News shows."
1009,3,Amazon Just Released A Sneak Peek At Its Black Friday Deals,🔍👀
1010,1,UCLA Players Arrested In China Arrive Home After Trump Talks To Xi Jinping,They were detained Nov. 7 in Hangzhou on shoplifting charges.
1011,4,Hannity: Roy Moore Should Explain 'Inconsistencies' Or Drop Out Of Senate Race,The Fox News host gives the former judge 24 hours to clear up sexual abuse allegations or exit the race.
1012,1,U.S. Goalkeeper's Gaffe Is A Reminder Of Soccer Team's Sucky State,Ethan Horvath commits a howler to remember.
1013,2,What To Buy On Black Friday At Target,There's no waiting in line when you shop online 💁
1014,3,15 Black Friday Laptop Deals Actually Worth Your Time And Money,There’s something on sale for every type of user 💻
1015,2,Which Stores Will Be Closed On Thanksgiving Day 2017?,Your holiday shopping can wait just one day.
1016,4,Russia Votes to Enact Restrictions On Foreign Media Outlets,Russia has named nine U.S.-backed outlets that may face new restrictions.
1017,1,'Kaep'tain America: This Is What A Patriot Looks Like,He gave up his dream of playing football for the people.
1018,3,Lack Of Diversity In Tech Makes It Difficult To Override Russian Fake News,"The outrage over Russian manipulation of social media platforms like Facebook, Google and Twitter during the 2016 election"
1019,4,"An Open Letter To Editors Rejecting #MeToo, #MeAt14 Submissions By Victims",I want to address the editors around the globe who are currently sifting through the very personal #MeToo and #MeAt14 narratives
1020,1,Before Ball There Was Me,The first thought I had when news broke about the alleged store thefts in China by UCLA freshman basketball player LiAngelo
1021,2,Millennials Can Afford To Buy A Home In These States,There have been a handful of reports over the past year detailing why millennials are no longer buying homes. In addition
1022,4,Alabama’s Biggest Newspaper Calls On GOP To Withdraw Support For Roy Moore,"The editorial board says the ""unseemly"" judge simply cannot be senator."
1023,1,LeBron James Rides The New York Subway And Ticks Off A Passenger,"Aggrieved rider James Michael Angelo later explained his ""Can you not?"" public transit moment."
1024,2,"Main Streets, Malls And Sustainable Consumption",We are in the midst of a number of fundamental changes in the nature of work and in the way we spend our time when we’re
1025,3,Company Blames Secret Intimate Recordings By Sex Toy On 'Minor Bug',Vibrator app wasn't directed to eavesdrop.
1026,4,Lisa Bloom 'Disturbed' By Bill O'Reilly's Lawsuit Against Accuser's Ex-Boyfriend,O'Reilly is suing a man over a Facebook post detailing sexual harassment accusations against the former Fox News host.
1027,4,Famed New York Gossip Columnist Liz Smith Dead At 94,"Her column was widely syndicated, and at her peak she earned more than $1 million a year."
1028,1,NFL Star Announces His Baby's Death In Devastating Message After Game,Marquise Goodwin caught a long touchdown pass in a game hours after his newborn son died.
1029,2,Corporate America’s Dirty Little Secret - Sexual Harassment,"Men are starting to ask, “What can I do?” The exposure of rampant sexual harassment is sadly in the news every day. These"
1030,4,Advertisers Ditch Sean Hannity Over His Coverage Of Roy Moore's Alleged Pursuit of Teens,"At least five companies, including Keurig and Nature's Bounty, have publicly distanced themselves from the Fox News host this week."
1031,4,Report: Rupert Murdoch Called AT&T's CEO Twice About CNN Sale,Is there a Fox in the Time Warner merger deal?
1032,1,Hope Solo Says Ex-FIFA President Sepp Blatter Groped Her,Blatter says the accusation isn't true.
1033,4,Critics Blast Newsweek’s 'Tone Deaf' Penis Balloon-Popping Trump Cover,"""Why does every attempt at female empowerment and safety-seeking get equated with castrating or otherwise 'harming' men?"""
1034,4,TNT Analysts Mocking UCLA Player's Arrest Is Not A Good Look,"Charles Barkley, Shaquille O'Neal and Kenny Smith pile on the jokes."
1035,4,Should We Be Concerned That Culture Creators Are Engaging In Sexual Abuse?,These men have enjoyed so much control over our culture for decades.
1036,3,"Twitter 'Verifies' Jason Kessler, Organizer Of Charlottesville White Supremacist Rally","In response to the backlash, Twitter paused its verification process, saying it needs to reconsider a broken system."
1037,4,Comedian Rambles About Louis CK's Accusations,"In a New York Times expose, Louis CK is accused of asking women if he could masturbate in front of them and then doing so"
1038,1,"Aaron Hernandez Had Most Severe CTE Ever Found For Someone His Age, Researchers Say",The troubled former New England Patriots player died of an apparent suicide earlier this year.
1039,1,3 UCLA Basketball Players Arrested In China On Shoplifting Charges,"One of them is LiAngelo Ball, brother of Lakers rookie Lonzo Ball and son of outspoken sports dad LaVar Ball."
1040,3,The Fakebook Inside Facebook,"This post first appeared at BillMoyers.com. Beginning in 2004, Mark Zuckerberg and his companions made a historic contribution"
1041,4,NPR CEO Jarl Mohn Takes Medical Leave Of Absence Amid Harassment Scandal,"He blamed a rise in hypertension for his leave, which comes after a top NPR editor resigned after sexual harassment allegations came to light."
1042,4,Weinstein's Lawyer Tried To Silence The Times While His Firm Was Representing The Paper,"The newspaper ""will be pursuing appropriate remedies,"" it said following the New Yorker report."
1043,2,Ocwen Financial: A Servicing Odyssey,Remember that obstinate computer from Stanley Kubrick’s 2001: A Space Odyssey — HAL 9000 — a machine with a will of its own
1044,4,"Sean Hannity, Tucker Carlson Declared Too Biased For UK Viewers","The Fox News hosts broke British impartiality rules, the country's media regulator said."
1045,2,21st Century Fox Reportedly Looking To Sell Majority Of Company To Disney,The deal would leave behind a much smaller Fox focused on news and sports.
1046,1,San Antonio Coach Gregg Popovich Won't Discuss Victory After Shooting,"""It's pretty meaningless,"" he said."
1047,4,Reddit And Violent Speech: Can Hate Be Banned?,There is no clear consensus on how to draw the line between free speech and hate speech.
1048,1,"3 Miami Dolphins Players Kneel During Anthem, Reversing Team Policy",Head coach Adam Gase previously told players to stand or stay in the tunnel.
1049,4,The President Of Stranger Things,Why we just can't turn away from Trump.
1050,4,Joe Scarborough Says Washington Would 'Melt Down' If Shooter Were Named Muhammad,"The ""Morning Joe"" host discussed President Trump's varied response to the Texas shooting and last week's New York terrorist attack."
1051,1,Shalane Flanagan Becomes First U.S. Woman To Win NYC Marathon In 40 Years,She defeated a Kenyan in the race's women's division.
1052,1,NFL Pledges Donations To Military Nonprofits In Hashtag Campaign,League leadership has spoken out against ongoing kneeling protests during the national anthem.
1053,4,"With The Shuttering Of Gothamist And DNAinfo, We All Lose","Two cornerstones of local New York news just disappeared. Meanwhile, on-the-ground reporting is more necessary than ever."
1054,4,"Billionaire's Decision To Shutter DNAInfo, Gothamist Could Chill Union Campaigns In Media",The next news site fighting a union drive likely will try to wield it as a cautionary tale.
1055,2,The Serious Price Of The Hyper-Convenient Economy,"Apart from sensual appeals, the chief marketing wave in our country is selling convenience. It has reached a level of frenzy"
1056,4,Publisher Of The New Republic Resigns Amid Harassment Allegations,The magazine says it will continue its investigation into Hamilton Fish's conduct toward female staffers.
1057,4,"Russian Trolls Didn't Need To Infiltrate The American Media, Because We Let Them In",We found more than 40 examples of Russian accounts easily weaseling their way into all sorts of news organizations — including ours.
1058,4,Jake Tapper Unloads On 'Sick' And 'Disgusting' Fox News In Blistering Takedown,"CNN host calls out Fox over a ""deliberate lie."""
1059,4,Fox News' Shepard Smith Gets Emotional Paying Tribute To New York City,"""New York City made you proud last night."""
1060,1,Houston Astros' Carlos Correa Proposes To Girlfriend On Live TV After World Series Win,"He'll walk away from the win with not one, but two rings."
1061,4,Gothamist Sites And DNAinfo Shut Down After Staffers Unionize,Their CEO cited financial reasons for the closure.
1062,4,Bruce Bartlett On Stopping Fake News In Its Tracks,Over the years Bruce Bartlett has experienced how the media covers politics and government from both sides – first as a Capitol
1063,2,"Uber, Lyft Ban Far-Right Journalist Following Islamophobic Tweets",Commentator Laura Loomer promised legal action against the ride-sharing companies.
1064,1,Cleveland Browns Reportedly Botch QB Trade Because Somebody Forgot To Call It In,They may have been celebrating a little too soon.
1065,1,"Baseball, Politics And Our Data-Driven Life","This post first appeared at BillMoyers.com. Anyone who follows baseball, whose World Series ends this week, knows that the"
1066,1,"Los Angeles Dodgers Rally Against Houston Astros, Force Game 7 Of World Series",Who's psyched?
1067,4,Top NPR Editor Resigns After Sexual Harassment Allegations,He was placed on leave Tuesday after the Washington Post published two women's accusations.
1068,4,Top NPR Editor Placed On Leave Amid Sexual Harassment Allegations,The alleged incidents occurred when Michael Oreskes headed The New York Times Washington bureau in the late 1990s.
1069,1,LeBron James As Pennywise The Clown Is Your Halloween Nightmare Come To Life,His Cleveland Cavaliers teammates also wowed with their impressive costumes at James' annual Halloween bash.
1070,4,People Are Officially Done With John Kelly After His 'Absurd' Civil War Comments,"The White House chief of staff blamed the war on a ""lack of compromise."""
1071,4,Here's What 'Fox & Friends' Covered On Manafort Indictment Day,"A tale of Trump tweets, Dean Cain and an emoji cheeseburger."
1072,1,"Houston Astros On The Brink Of World Series Crown After Thrilling, Extra-Innings Win Over Los Angeles Dodgers","The Astros, who lead the series 3-2, now have two chances in Los Angeles to win their first World Series since the inception of the franchise 55 years ago."
1073,2,Seattle Woman Says Her Identity Has Been Stolen 15 Times Since Equifax Data Breach,“I want to share my story and make people aware that this can happen to anybody.”
1074,2,"To Create A New Amazon Village, It Takes A Graduate Degree (Or Two, Or Three)",Amazon made headlines with its stupendous 1300% “earnings beat” for its most recent quarter that moved the company’s stock
1075,1,Fan Grabs World Series Home Run From Another Fan To Throw It Back,"“I just would have liked to have been able to throw it back myself."""
1076,4,Media Skewered For Focus On Kevin Spacey Coming Out Rather Than Harassment,"""THIS IS NOT THE STORY."""
1077,4,NBC Fires Mark Halperin Following Sexual Harassment And Assault Allegations,At least a dozen women have publicly accused him of sexual misconduct.
1078,1,Would The NFL Owners Really Listen To Kaepernick?,What would happen if they did?
1079,1,Astros Player Suspended For 5 Games For Racist 'Slant-Eye' Gesture,"Yuli Gurriel apparently made the gesture in reference to Yu Darvish, who was born in Japan."
1080,4,Keith Olbermann Breaks Down Just How Donald Trump Manipulates Americans Via Twitter,"""He has perfected the fireside tweet."""
1081,2,Because Sexual Abuse Is The Old Normal,Don’t let Bill O’Reilly dominate any part of our culture again.
1082,4,Bill Maher: Trump's Relationship With Fox News Is A 'Very Bad Axis Of Evil’,"""Fox News has become state TV."""
1083,2,Amazon Stock Surge Makes Jeff Bezos Richest Man On Earth,His net worth jumped $10.4 billion in a single day to $93.8 billion.
1084,2,The Lack Of Women Leaders Is A National Emergency,"Men run everything, and it's enough already. Want to stop sexual harassment? Fix this now."
1085,1,A Kitten’s Scramble Was The Best Play On Thursday Night Football,This tailback must have been chasing a Raven.
1086,4,Fox News Revenues Nosedive Despite Trump's Constant Viewing,MSNBC is up 2 percent and CNN is down just 1 percent.
1087,2,CVS Is Reportedly In Talks To Acquire Aetna,The pharmacy chain's move is likely motivated by concerns Amazon could enter the health care sector.
1088,4,New York Times Comment Goes Hilariously Wrong,Whoops!
1089,4,'Morning Joe' Hosts 'Fully Support' Decision To Suspend Longtime Contributor Mark Halperin,"""We’re not going to avoid the story just because he is our friend,"" co-host Mika Brzezinski said."
1090,4,Bill O'Reilly Allegedly Called Woman He Was Harassing To Get Dirt On Another Victim,The ex-partner of the woman O'Reilly supposedly telephoned says he heard the conversation.
1091,2,Three Women Sue Uber For Discrimination Based On Gender And Race,The lawsuit says that Uber’s compensation and other practices discriminate against women and people of color.
1092,4,Former Fox Host Eric Bolling Says His Son Died Of An Accidental Overdose,The death of 19-year-old Eric Chase Bolling has been linked to opioids.
1093,4,"Fox News Devoted Hours To Harvey Weinstein Scandal, But Minutes To Bill O’Reilly’s","""At this pace, Fox News would need 21 years to give O'Reilly the amount of coverage they gave Weinstein over 3 weeks."""
1094,3,"As Puerto Rico Struggles In Darkness, Tesla Brings Light To Children’s Hospital In San Juan",The company is making quick work of its promise to help restore power to the hurricane-ravaged island.
1095,4,Multiple Women Accuse Veteran Journalist Mark Halperin Of Sexual Harassment,"“I now understand from these accounts that my behavior was inappropriate and caused others pain,"" he says."
1096,3,Amazon To Sell Smart Locks So It Can Slip Packages Into Your Home,The move signals Amazon’s ambitions in the growing market for home security devices.
1097,2,"Target Claims It Won't Start Christmas Early, Then Starts Christmas Early Anyway",Retailer's promise not to launch the holiday season early comes with an asterisk.
1098,4,Why We Need 'Pull-No-Punches Reporting' That Holds Big Corporations And Moneyed Interests Accountable,The problem with the media today is not fake news. The problem is that we don’t get enough of the news we really need. I
1099,4,"'I Was Blind And Complicit And Just, Like, Did Nothing': New Republic Staffers Speak Out","The magazine's literary editor, Leon Wieseltier, is accused of harassment and inappropriate behavior."
1100,2,Get Ahead Of The Problem: 5 Actionable Steps To Address Sexual Harassment At Your Company,Hold a team meeting to let your employees know you have their back.
1101,4,Donald Trump Is A 'Dangerous Clown' On The New Yorker’s New Cover,"""He’s already a cartoon villain, infantile and strange."""
1102,4,"Even As California Burned, Fox News Favored Trump's NFL Controversy","Overall, cable news gave Trump's NFL comments more than triple the segments it gave California's wildfires."
1103,4,Twitter Is A More Comfortable Place For Perpetrators Than It Is For Sexual Violence Survivors,I've seen firsthand how the social media behemoth undercuts victims and enables rape apologists.
1104,1,"Seattle Star Megan Rapinoe Blasts Soccer's World Body As 'Old, Male And Stale'","FIFA ""doesn't care about female players,"" the World Cup winner says."
1105,4,Leon Wieseltier’s New Magazine Is The Latest Casualty In Reckoning Over Bad Male Behavior,"Laurene Powell Jobs' organization has cut ties with Wieseltier over what it calls his ""past inappropriate workplace conduct."""
1106,4,Bill O'Reilly Dropped By His Talent Agency,The move follows reports of a $32 million O'Reilly sexual harassment settlement.
1107,4,Eric Bolling Tells Bill O’Reilly Not To Use His Son’s Death As Political Cover,The Fox News fallout continues as O'Reilly later apologizes.
1108,1,'Sunday Night Football' Looked Like A Halloween Horror Movie,The long-awaited Super Bowl rematch got weird.
1109,4,Megyn Kelly Reveals She Complained To Fox News About Bill O'Reilly,Kelly delivered a pointed monologue Monday about her former colleague.
1110,4,Mark Cuban May Run Against Donald Trump In 2020 As A Republican,"“I wouldn’t run unless I have solutions."""
1111,2,Lobbying Spending Hits Historic Lows,by Geoff West Washington lobbying groups spent less money and reported fewer lobbyists during the third quarter of 2017 than
1112,4,New Investigative Website Fights Rich And Powerful ‘Who Call the Shots’,Corporate insider-turned-whistleblower Wendell Potter starts up an investigative website to expose corruption and show the public how to fight back.
1113,1,Sports Illustrated Predicted Astros Would Win 2017 World Series Years Ago (UPDATE),The magazine appeared to foresee another key development in series.
1114,4,"In Joke Few Find Funny, Czech President Waves Fake Gun Marked 'For Journalists'","A few months ago, Milos Zeman was caught telling Russia's Vladimir Putin that journalists should be killed."
1115,1,Donald Trump's 2012 Yankees Tweet Proves There Really Is A #TweetForEverything,"Yes, even for Major League Baseball."
1116,4,Rachel Maddow Defends Niger Theory After Experts Call It 'Conspiracymongering',The MSNBC host suggested Trump's travel ban may have caused the deadly ambush. Experts disagree.
1117,4,Report: Fox Renewed Bill O'Reilly's Contract After $32 Million Harassment Settlement,The network knew of the agreement when it renewed O'Reilly's contract.
1118,1,Houston Astros Head To World Series,The Astros will face the Dodgers when the World Series begins on Tuesday in Los Angeles.
1119,4,"Jemele Hill Says She Deserved ESPN Suspension ""After My Donald Trump Tweets""","But Hill said she'll ""never take back what I said."""
1120,2,The Most Common Financial Mistakes To Avoid,Take control of your money.
1121,2,Move The Starting Line: COO Knows Diverse Teams Yield Creativity,"Yes, she knows it sounds odd coming from someone with an undergraduate degree from Northwestern University and a masters"
1122,1,Dodgers Co-Owner Magic Johnson Goes Bonkers Watching Team Romp To World Series,"""That's what I'm talking about, baby!"""
1123,1,Dodgers Reach World Series For First Time Since 1988,The Los Angeles Dodgers beat the Chicago Cubs 11-1 to clinch the National League Championship Series.
1124,3,Silicon Valley Veteran Says Tech Giants 'More Powerful Than AT&T Ever Was',"“We have more and more concentrated power and wealth,"" Sam Altman said."
