id,category,headline,short_description
1,1,Jets Chairman Christopher Johnson Won't Fine Players For Anthem Protests,"“I never want to put restrictions on the speech of our players."""
2,2,"U.S. Launches Auto Import Probe, China Vows To Defend Its Interests",The investigation could lead to new U.S. tariffs similar to those imposed on imported steel and aluminum in March.
3,1,Trump Posthumously Pardons Boxer Jack Johnson,The pardoning of the black heavyweight boxer is only the third posthumous pardon in U.S. history.
4,4,Jake Tapper Shreds Donald Trump With A Long List Of His Conspiracy Theories,"""I could go on, but this is just an hour show."""
5,4,New York Daily News Rips NFL Over Anthem Kneeling Ban,"""NFL DISHONORS THE FLAG"""
6,1,Anna Kournikova Dancing With Her Bouncing Baby Is The Cutest Thing,The score is love-love.
7,1,Trump Says NFL Players Unwilling To Stand For Anthem Maybe 'Shouldn't Be In The Country',"""I don’t think people should be staying in locker rooms,"" Trump told Fox News. ""You have to stand proudly for the national anthem or you shouldn’t be playing."""
8,3,Facebook Accused Of Reading Texts And Accessing Microphones In Lawsuit,A failed startup suggested that Facebook mounted what could be described as mass surveillance.
9,3,Self-Driving Uber In Fatal Accident Had 6 Seconds To React Before Crash,The NTSB published a preliminary report on the incident Thursday.
10,1,Brandi Chastain Totally Agrees Her Hall Of Fame Plaque Looks Nothing Like Her,Was it supposed to be Gary Busey or Mickey Rooney?
11,1,NFL Bans Kneeling During The National Anthem,Teams can set their own policies for punishing players.
12,4,'60 Minutes' Reporter Reveals Trump's Chilling Reason For Slamming The Press,"Lesley Stahl said Trump admitted that he attacks journalists so ""no one will believe"" them."
13,3,Instagram Is Adding A 'Mute' Button For The Sake Of Your Sanity,And no one will know when you use it.
14,2,Starbucks Says Anyone Can Now Sit In Its Cafes -- Even Without Buying Anything,The new policy was unveiled weeks after the controversial arrest of two black men at a Philadelphia Starbucks.
15,4,David Hogg Calls On Media To Stop Naming Santa Fe School Shooter,"""We make these sick people known worldwide for their horrifying acts, let’s stop that."""
16,1,The History Of The National Anthem In Sports,"How ""The Star-Spangled Banner"" became a part of American sports culture."
17,3,Cambridge Analytica Files For Chapter 7 Bankruptcy After Facebook Privacy Row,The firm at the center of the Facebook data hack made the decision after suffering a sharp drop in business.
18,4,Hannity Flips Out: Mueller Probe 'Is A Direct Threat To This American Republic',"""Mueller is causing irreparable damage to the rule of law in this country.”"
19,4,Fox News' First Female CEO Was Named In Sexual Harassment Complaints,"Suzanne Scott, a Fox News lifer, has been accused of helping foster a toxic workplace for women at the cable network."
20,3,Why Isn't There A Birth Control Emoji?,Two women decided it was time to have one.
21,4,Fox News Said To Settle Group Of Discrimination Lawsuits For About $10 Million,"A New York Times report detailed the agreement the network reached with multiple plaintiffs, including anchor Kelly Wright."
22,3,Facebook Removed More Than 500 Million Fake Accounts In First Quarter Of 2018,"Facebook's first community standards enforcement report shows the company is ""trying to be as open as we can,” an executive said."
23,3,"Tesla Autopilot Was Engaged During Horrific 60 MPH Crash, Driver Tells Police",Tesla CEO Elon Musk tweeted that it's amazing the driver wasn't more seriously injured.
24,4,Fox News Judicial Analyst Defends Timeline Of Mueller's Probe,"“Bob Mueller has no duty to tip his hand and show his cards until the end of his investigation,"" Andrew Napolitano said."
25,4,'DADDY'S LITTLE GHOUL': New York Daily News Rips Ivanka Trump Over Embassy Opening,"The tabloid said the first daughter was ""all smiles"" as protesters died in Gaza."
26,2,Seattle Passes Controversial New Tax On City's Biggest Companies To Combat Housing Crisis,"Following the council vote, Amazon’s vice president, Drew Herdener, said the company has resumed construction planning for its so-called Block 18 project in downtown Seattle."
27,2,"Uber Ends Forced Arbitration In Individual Cases Of Sexual Assault, Harassment",Victims will be free to go to court -- but a few caveats remain.
28,3,Facebook Suspends 200 Apps Amid Data Misuse Investigation,The investigation was launched in response to the Cambridge Analytica scandal.
29,4,Huge Congrats To Fox News On Getting Guest Journos To Peddle Bret Baier’s Book,Who's falling in line for Fox News?
30,1,Israeli Soccer Team Beitar Jerusalem To Add 'Trump' To Its Name,Beitar Jerusalem said it's making the move to honor the U.S. embassy's relocation.
31,1,"Coach Tells Hurt UFC Fighter To Continue After She Says, 'I'm Done'",Raquel Pennington took even more of a beating in a bloody loss to champion Amanda Nunes.
32,2,"Chili's Hit By Data Breach, Credit And Debit Card Information Compromised",The breach is believed to have occurred between March and April.
33,4,Fox News Host: Trump Fulfilled Biblical Prophecy By Moving U.S. Embassy To Jerusalem,Jeanine Pirro also compared Trump to King Cyrus.
34,3,Keyless Cars Have Killed More Than 2 Dozen People Since 2006: Report,Drivers have succumbed to carbon monoxide poisoning after forgetting to turn off a vehicle in their garage.
35,3,Possible Autopilot Use Probed After Tesla Crashes At 60 MPH,It's not yet known if the autopilot was engaged. The car's driver suffered a broken ankle.
36,3,Boston Dynamics' 'Robot Dog' May Be Available For Sale Soon,"Super cool, or bone chilling?"
37,2,How Uber Silences Women After Sexual Assaults,"Just by using the app, you click away your rights. Now some victims are fighting for change."
38,2,How Amazon Is Holding Seattle Hostage,"The city wants to tax large corporations to pay for homeless housing, but Jeff Bezos isn't pleased."
39,4,Fox Cuts Ties With Guest Who Cited John McCain To Defend Torture,Tom McInerney previously has promoted the birther conspiracy theory against President Barack Obama.
40,4,Michael Avenatti Warns Michael Cohen: I Still Have More Documents To Release,"“We’ve got emails, we’ve got text messages, we’ve got other financial information."""
41,4,"'Fox & Friends' Host Mocks NY Times' ISIS Coverage, Unaware It Beat Fox To The Story",Whoops.
42,4,'A LITTLE EXTORTION-Y'...This Guy Figured Out What Stormy Daniels' Old Lawyer ACTUALLY DOES — And It's Not Pretty!,How sex-scandal lawyer Keith Davidson works the Hollywood tabloid racket and muscles journalists.
43,4,Fox Business Guest Defends Torture: It Worked On John McCain,"""That's why they call him 'Songbird John.'"""
44,4,Phil Mudd Flips Out Over Questions About CIA Torture: 'We Didn't Do It. America Did It.',The CNN analyst and former CIA official also blamed Congress and the DOJ for the agency's defunct torture program.
45,3,Jet Just Launched Its Own Apple Store With Some Incredible Deals,"If you’re on a time crunch to find a perfect Mother’s Day gift that’ll still arrive on time, it’s your lucky day. Amazon"
46,4,Anderson Cooper Burns 'Moronic' Michael Cohen Over Russia Cash Claims,CNN host says it doesn't look good for Trump's personal attorney.
47,4,"ESPN Eliminates Public Editor Role, Calling It Outdated","As media distrust grows, another outlet drops its liaison between the public and the newsroom."
48,4,Fox News Judicial Analyst Issues Dark Warning To Trump Over Michael Cohen,"""Mr. President, please be wary of all of this,"" Andrew Napolitano said."
49,1,$18 Derby Day Bet Wins Thrilled Texas Woman $1.23 Million,"It was like a ""mini-lotto,"" says the Pick 5 winner."
50,1,U.S. Olympic Committee Ignored Sexual Abuse Complaints Against Taekwondo Stars: Lawsuit,Over 45 women have accused Jean and Steven Lopez of sexual misconduct.
51,4,Bill O’Reilly Offers To Stand Next To Sarah Sanders To Handle ‘Out Of Line’ Reporters,"""I will tell them exactly what I think of their behavior."""
52,2,Bank Of America Appears To Flip On Firearm Promise With Loan To Remington,The bank pledged in April to stop financing companies that sell military-style firearms to civilians. Remington made the Bushmaster rifle used in the Sandy Hook school massacre.
53,4,"Christiane Amanpour Heading Up New PBS Show, Replacing Charlie Rose",She's the latest woman to replace a man disgraced by sexual misconduct allegations.
54,4,Shepard Smith: You Can't Say Trump Pulled Out Of Iran Deal; He Made Decision To Violate It,"""‘Pulling out’ is a bit of a misnomer,"" the Fox News host said."
55,4,Tronc Decides To Voluntarily Recognize The Chicago Tribune Guild,The decision marks a major shift from its campaign against unionization at the Los Angeles Times last year.
56,4,'Fox & Friends' Host Brian Kilmeade Says Gina Haspel Should Be 'Proud' Of Torture Record,The nominee for CIA director will appear before the Senate Intelligence Committee for her confirmation hearing on Wednesday.
57,3,"Software In Fatal Uber Crash Reportedly Recognized Woman, Then Ignored Her",The first-of-its-kind accident killed a pedestrian in Arizona earlier this year.
58,4,Jake Tapper Grills Kellyanne Conway: I'd Like Trump To Stop Lying,"""You just want that to go viral,"" Conway shot back."
59,4,Michael Avenatti Scorches Rudy Giuliani Over His Latest 'Train Wreck' Interview,"""He's done considerable harm to the president,"" Stormy Daniels' lawyer said."
60,4,Fox News Host Neil Cavuto Taunts Trolls Who Came For Him After Trump Takedown,"“No, you shut up!"""
61,3,Twitter Warns Users To Change All Their Passwords After Finding Bug,"An “internal defect” led users’ account passwords to be stored in an internal log, the company said."
62,1,Why The Kentucky Derby Horses Have Such Interesting Names,"This year's competitors include Free Drop Billy, Good Magic and Instilled Regard."
63,3,Alexa Can Remember Birthdays And Other Things For You Now,"Last week at a conference in France, Amazon announced a new Alexa feature that makes it possible to use the smart assistant"
64,1,Here's Why We Say The Expression 'Hands Down',A little slice of trivia to wow your friends during the Kentucky Derby.
65,4,Fox News Host Neil Cavuto Tells Trump He Stinks In Fiery Takedown,"""I guess you’re too busy draining the swamp to ever stop and smell the stink you’re creating."""
66,3,Apple Watch Credited With Saving New York Man's Life,The device alerted him to an alarmingly fast heart rate.
67,4,Jeffrey Toobin: Rudy Giuliani Just Confessed That Stormy Daniels Payment Broke The Law,"Trump's newest lawyer sounds like he's mindlessly riffing, the CNN chief legal analyst said."
68,2,Ex-Volkswagen CEO Charged In U.S. Over Emissions Cheating Scandal,Martin Winterkorn resigned soon after the scandal became public in 2015.
69,4,Leak: The Atlantic Had A Meeting About Kevin Williamson. It Was A Liberal Self-Reckoning.,"In a staff meeting, Jeffrey Goldberg and Ta-Nehisi Coates discussed the hiring and firing of a conservative writer. But it wound up being about a lot more than that."
70,4,"Michael Avenatti Stunned By Rudy Interview: 'No Way, No How' Trump Finishes His Term Now",Stormy Daniels' attorney says Giuliani's admissions will doom the presidency.
71,4,We Probed Sexual Misconduct Claims Against Journalist Al Giordano. Here's What We Found.,The reporter and activist denies accusations he sexually harassed three attendees of his School of Authentic Journalism.
72,1,MLB Pitcher Punches Himself In Face Really Hard After Blowing Game,"Astros reliever Ken Giles said he was ""frustrated."""
73,1,How Nick Foles Got Back Up,The Super Bowl MVP chats with a childhood friend about his unusual journey from NFL backup to star to backup again.
74,4,CEO Mark Zuckerberg Says Facebook Will Rank News Outlets By Trustworthiness,The social media titan says the rankings will determine placement in its News Feed feature.
75,2,"Women Describe Rampant Groping, Sexual Harassment At Verizon-Contracted Warehouse",Verizon launched an investigation soon after HuffPost reached out for comment.
76,1,"Washington NFL Cheerleaders Say They Were Required To Pose Nude, Act As 'Escorts': Report",The New York Times report comes on the heels of two lawsuits from other teams' cheerleaders alleging discriminatory treatment.
77,3,Facebook Will Let Users See Which Sites Are Tracking Them,You'll be able to stop Facebook from linking browsing data with your account.
78,3,Facebook Investigates Claim That Employee Used 'Privileged Access' To Stalk Women,"A Facebook engineer was fired after allegedly self-identifying as a ""professional stalker"" and telling a woman on Tinder that she was ""hard to find."""
79,3,Facebook Gets Into The Online Dating Business,"Facebook (FB) wants to help get you … into a long-term relationship. That’s according to CEO Mark Zuckerberg, who announced"
80,4,"A Running List Of Cowards, Courtiers, Strivers And Suck-Ups",Democracy dies in the Washington Hilton.
81,3,Facebook Bug Asks Users If Puppies And Bahamas Vacations Are Hate Speech,A glitch on Tuesday morning led Facebook to question everything posted on the site.
82,4,Alleged Sexual Predators Don't Need Letters Of Support,The public defense of NBC's Tom Brokaw derails a much-needed conversation about sexual harassment and sends a dangerous message to employees.
83,3,WhatsApp Co-Founder To Leave Company Amid Disagreements With Facebook,Jan Koum reportedly differed with WhatsApp's corporate parent over encryption and user privacy.
84,4,New York Times Editor Resigns Following Investigation: Staff Email,Details about the nature of the investigation were not immediately available.
85,1,Cowabunga! Brazilian Rodrigo Koxa Breaks World Record Surfing 80-Foot Wave,"""I got a present from God,"" the gutsy surfer said at a World Surf League ceremony."
86,4,Fox News Reporter: Sarah Huckabee Sanders Deserves Apology After Press Dinner,"Comedian Michelle Wolf is ""mean, hateful and vile,"" Ed Henry said."
87,4,National Enquirer Turns On Michael Cohen,"“The president is in the hot seat because of his lawyer,"" according to the Trump-friendly tabloid."
88,4,Joy Reid's Defenders Praise Her Apology — But Ignore Her Apparent Cover-Up,"The MSNBC host's most ardent fans are willing to turn a blind eye to her hacking claims, and that's unsettling."
89,2,T-Mobile Agrees To Acquire Sprint For $26 Billion,U.S. regulators are expected to grill the companies on how they will price their combined wireless offerings.
90,4,Joy Reid Says She Doesn't 'Believe' She Wrote Anti-LGBTQ Posts,"The MSNBC host added Saturday that cybersecurity experts have not been able to prove her blog was hacked, as she initially claimed."
91,1,Shaquem Griffin Becomes First One-Handed Player Selected In NFL Draft,Griffin joins his twin brother Shaquil on the Seattle Seahawks.
92,1,"Trump Meets The 2018 Olympic Team, With A Few Major Absences","Not present: Lindsay Vonn, Gus Kenworthy, Adam Rippon, Chloe Kim and more than a couple others."
93,1,Super Runner Semenya Faces New Testosterone Limits In Sports Gender Battle,Officials grapple again with fair competition and gender definition.
94,4,2 Women Accuse Tom Brokaw Of Sexual Harassment In The '90s,A former NBC News war correspondent is among those accusing the longtime anchor.
95,4,Anderson Cooper Shreds 'Incoherent' Trump: 'Like A Crazy Person On A Park Bench',CNN host tries in vain to make sense of Trump's Fox News interview.
96,4,"Rush Limbaugh Vividly Describes Alleged Trump Pee Tape, Then Says It's All Fake","""Somebody is going to produce a tape of prostitutes peeing on a bed."""
97,4,Watergate Prosecutor Warns Trump: Pleading The Fifth Is 'Political Suicide',"Jill Wine-Banks says Michael Cohen can get away with it, but Trump can't."
98,1,LeBron James Nails Incredible 3-Point Buzzer-Beater To Seal Game 5 For Cleveland,Game-winning shot puts Cleveland up 3-2 in playoff series against Indiana.
99,4,Daily Beast Suspends Joy Reid Column Amid Scrutiny Over Her Hacking Claims,"The allegations that she wrote homophobic posts ""deserve a full examination,"" the site's executive editor told staff."
100,4,"Gretchen Carlson Wants To Spotlight Comebacks By Victims, Not Sexual Harassers","""Those stories are a slap in the face to all the women who have lost their careers,” the former Fox News anchor says."
101,4,Joy Reid’s Hacking Claims Look Increasingly Unlikely,"Only a pretty bizarre course of events would have led to those allegedly ""fraudulent"" homophobic blog posts."
102,4,New York Times Journalists Who Broke Harvey Weinstein Story Are Getting A Movie,"The film aims to be the next ""Spotlight"" or ""All the President's Men,"" focusing on the dogged reporting."
103,4,Chris Cuomo And Kellyanne Conway Go Bananas In New Interview,"""Everything with you guys is fruit salad,"" Cuomo says to Conway."
104,4,Billionaire Peter Thiel Agrees To Not Buy Gawker After Funding Site's Demise,What the PayPal co-founder planned to do with the news site remains unclear.
105,4,"Joy Reid Doubles Down: Homophobic Posts ‘Hacked,' ‘Fraudulent’",This is the second time the MSNBC host has been accused of making homophobic comments on an old blog.
106,4,Anderson Cooper Taunts Trump With 4 Blistering Questions About His 'Best People',"""If the president hires only the best people, why aren’t they still on the job?"""
107,3,"From Cursing To Murder, Facebook Opens Up About The Site's 'Community Standards'","For years, Facebook had “community standards” for what people can post, but only a relatively brief and general version was publicly available."
108,4,Chicago Tribune Newsroom Overwhelmingly Supports Unionization,"In emails sent Tuesday, the organizing committee revealed 85 percent support for unionization among the newsrooms making up the Guild."
109,4,"HuffPost Expands Its Reporting, Video And Audio Teams With Latest Round Of New Hires","HuffPost today announced a series of new hires, adding members to the reporting, video and audio teams across three time"
110,4,Laura Ingraham Slams Advertisers Who Fled Her Show: 'They All Gave In To The Mob',"The Fox News host tells the left to ""keep demonizing me."""
111,3,Professor Who Sold Facebook Data To Cambridge Analytica 'Sincerely Sorry',"Aleksandr Kogan said he assumed people were aware that their data was being taken, but just didn't care."
112,1,McKayla Maroney Says She Told Olympic Coach Of Nassar Abuse In 2011,"Maroney told ""Dateline"" she reported the abuse to John Geddert during the 2011 World Championships, but he did nothing."
113,4,Twitter Erupts After Obama Makes Melania Trump Smile At Barbara Bush's Funeral,What did the former president say to the first lady?
114,1,Colin Kaepernick Receives Amnesty International's Highest Honor For Activism,"The NFL quarterback took a knee during the national anthem to protest police brutality and inequality, stirring a wave of activism in pro sports."
115,4,LA Times Union Preparing Class-Action Lawsuit Over 'Illegal Pay Disparities',"Last week, an analysis of the newsroom's pay structure revealed wide discrepancies along racial and gender lines."
116,1,Lance Armstrong Settles $100 Million Federal Fraud Case For $5 Million,"The former cycling champion was accused of defrauding his sponsor, the U.S. Postal Service, by using performance-enhancing drugs."
117,4,Stormy Daniels' Attorney Predicts: 'I Do Not Think The President Will Serve Out His Term',Michael Avenatti said this won't end well for Donald Trump.
118,1,The Karolyis Say They Had No Idea About Nassar Abuse At Their Training Facility,Martha and Bela Karolyi of the elite gymnastics training center the Karolyi Ranch finally broke their silence on Larry Nassar.
119,4,Conservative Pundit S.E. Cupp Hits Trump White House Right In The Balls,"The HLN host says Nikki Haley ""makes her male counterparts look like scared schoolboys."""
120,4,Laura Ingraham's Guest Mocks Her On Live TV For Losing Advertisers,"""A high school kid shut you down!"""
121,4,How To Write A Comeback Story About An Alleged Sexual Predator,"Please don’t -- but if you must, here’s a guide to writing the most unnecessary stories of the Me Too movement."
122,1,The NBA Shows Its Love For Gregg Popovich After Wife's Death,"""It's bigger than winning and losing,"" Warriors star Kevin Durant said."
123,1,McKayla Maroney Says Larry Nassar Abused Her Hundreds Of Times,The Olympic gymnast said the now-imprisoned former USA Gymnastics team doctor groomed her with food.
124,4,Sinclair Broadcast Boss Donated To GOP Rep Who Assaulted Reporter,The local TV news giant is making no effort to conceal its conservative bias.
125,4,Chuck Todd Slams Fox News For Sean Hannity's Michael Cohen Connection,"""No serious news org would allow someone this conflicted to cover this story,"" he said."
126,4,Fox News' Judicial Analyst Absolutely Shreds Hannity's Cohen Claim,"“He can’t have it both ways,"" says Andrew Napolitano."
127,4,Laura Ingraham Cracks At Hannity: I'm Glad The 'Heat's Off Me And On You!',Fox News hosts joke about their negative press.
128,4,"Carl Kasell, Iconic Newscaster Whose Voice Defined NPR, Dead At 84",The famed radio man died of complications from Alzheimer's disease.
129,4,Stormy Daniels' Attorney Predicts Michael Cohen Will Turn On Trump,"Michael Avenatti said the president's attorney could face ""decades"" in prison if he doesn't flip."
130,2,The SEC Just Made The Case For Divesting From Fossil Fuel Companies Much Stronger,"The agency's ruling in a little-noticed case last month has knocked the wind out of the push for shareholder activism, a favorite neoliberal tactic to address climate change."
131,2,Dick's Sporting Goods Is Destroying Its Unsold Assault-Style Rifles,The company pulled assault-style weapons and accessories from their stores in February.
132,4,New York Daily News Scorches Sean Hannity With New Cover,The tabloid did not hold back.
133,2,Facebook Didn’t Seem To Care I Was Being Sexually Harassed Until I Decided To Write About It,"Two months ago, a pro-Trump Facebook group posted my photo and asked its 72,000 members if they would ""smash or pass."""
134,4,This Year's Pulitzer Prizes Honor Reporting On The Me Too Movement,The New York Times and The New Yorker jointly won for their coverage of sexual assault in Hollywood.
135,1,Desiree Linden Becomes First American Woman To Win Boston Marathon In 33 Years,The last time an American woman won was in 1985.
136,3,Facebook's Tracking Of Non-Users Sparks Broader Privacy Concerns,"CEO Mark Zuckerberg said that, for security reasons, the company collects “data of people who have not signed up for Facebook.”"
137,2,"In Los Angeles, Bitter Tensions Over Where To House The Homeless Rile Communities","Voters approved a plan for supportive housing, but disputes over where to put it have stalled progress."
138,1,Boxer Wearing 'America 1st' Shorts Gets Pounded By Mexican Opponent,The message on those boxing shorts is truly below the belt.
139,3,"Some Criminals Have A ‘Right To Be Forgotten’ On Google, UK High Court Rules",A London judge says Google must scrub search results related to one man’s prior criminal conviction — but not for another man.
140,4,"Ace Hardware Resumes Laura Ingraham Advertising, Sparking Outrage",The hardware chain said it reversed a decision based on “incomplete information.”
141,4,Donald Trump's Hometown Newspaper Just Burned Him With A Savage Nickname,"New York Daily News comes out swinging over Comey's claim that the president was ""obsessed"" with the alleged ""pee tape."""
142,4,Laura Ingraham Accidentally Delivered The Best Self-Own Of 2018,Fox News host has now lost more than two dozen sponsors.
143,3,"Uber Is Adding A Panic Button, 3 Years After Rolling One Out In India",The app company also says it will run more background checks on its drivers.
144,1,The Yankees And Red Sox Brawl Because That's How It Must Be,Punches flew in the first series of the year between the rivals.
145,4,HuffPost Signs With ICM Partners,"LOS ANGELES, CA and NEW YORK, NY ― ICM Partners, one of the world’s preeminent talent and literary agencies, today announced"
146,4,"In Historic Move, Chicago Tribune Staffers Prepare To Unionize",The paper's corporate overlords at Tronc have stood firmly opposed to unions in the past.
147,1,32-Year-Old Minor-Leaguer Called Up To Lakers Aces NBA Debut,"""The crowd, the lights -- it was once in a lifetime,"" Andre Ingram said after scoring 19 points."
148,4,Preet Bharara: 'High' Likelihood Michael Cohen Is Going To Be Charged,The former U.S. Attorney for the Southern District of New York was fired by Trump last year.
149,4,Getty Mixed Up Mark Zuckerberg's Executive Assistant With Priscilla Chan,C'mon now.
150,4,Stormy Daniels’ Lawyer Taunts Trump: Michael Cohen Will ‘Fold Like A Cheap Deck Of Cards’,"Michael Avenatti says Cohen is ""closer to a purse puppy than a tough guy."""
151,4,Laura Ingraham's Sponsors Still Bolting Over Comments About Parkland Survivor,Blue Apron and SlimFast announced that their ads will no longer appear on the program after Monday's episode.
152,2,The Libertarian Political Movement Is Dead,American democracy doesn't look much better.
153,4,"In Wyoming, A Newly Unionized Newsroom Says Corporate Bosses Are Retaliating","“It’s fair to say they’re going to war with us,"" said one newsroom source."
154,4,21st Century Fox Offices In London Raided By European Commission Investigators,Fox Networks Group said it was cooperating with the EC inspection.
155,4,"Ingraham Returns To Airwaves With No Apology, And Few Advertisers","""Left-wing activists use these terms as bludgeons to intimidate those who disagree with them."""
