id,category,headline,short_description
483,4,Shepard Smith Gives Fox News Viewers A Reality Check After Florida School Shooting,Some things haven't changed much since Columbine.
484,4,"After Florida Shooting, The Teens Become The Strongest Voice For Gun Control",The people making the most sense about a high school massacre that left 17 dead are the kids who survived it.
485,4,Viral Onion Story On Mass Shootings Hits Too Close To Home,"‘No Way To Prevent This,’ Says Only Nation Where This Regularly Happens"
486,4,Comedy Writer Calls Out GOP In Blistering Replies To 'Prayers' After Florida Shooting,Bess Kalb has names and dollar amounts for NRA-linked lawmakers.
487,1,Shaun White Makes History With Gold Medal Win In Halfpipe,He became the first person to win three gold medals in Olympic snowboarding competitions.
488,1,Olympic Skier Gus Kenworthy Has A ‘Game Of Thrones’ Doppelgänger,"""I'm just saying we've never seen you at the same place at the same time."""
489,1,Olympians Shut Down Local Fox Anchor Who Said Figure Skating Is 'Not A Sport',"Gracie Gold, Vincent Zhou, Chris Knierim and Jeffrey Buttle all waded in."
490,1,Shaun White Dismisses Sexual Harassment Allegations As 'Gossip',"He later admitted that ""it was a poor choice of words."""
491,1,Guess What Happened When Lindsey Vonn Tweeted She Had No Valentine,"One potential beau said being ""friendzoned"" by the Olympian would look perfect on his resume."
492,2,Uber Is Still Losing Carloads Of Money,But the ride-hailing pioneer seems to be slowing the bleeding.
493,1,16-Year-Old Snowboarding Sensation Suffers Sickening Crash In Halfpipe Final,Japan's Yuto Totsuka had to be taken down the pipe in a stretcher.
494,1,South Korea To Pay Record $2.64M For North Korea's Olympic Visit,The gesture is in hopes of lowering tensions between the two countries.
495,1,Barstool Sports Host Makes Tasteless Comment About Underage Olympian Chloe Kim,Chloe Kim has emerged as the best story from the PyeongChang Olympics thus far. Everyone wants to talk about her victory
496,1,Baby Watching Her Olympian Dad Compete On TV Will Give You Gold Medal Feels,She's got her cute mojo working for Canada's Winter Olympics curling team.
497,1,"Michael Phelps And Wife Nicole Welcome Second Son, Beckett",Now the family's big enough for a relay team.
498,1,Tara Lipinski And Johnny Weir Have The Cutest Olympics Pre-Show Ritual,Copy it if you can.
499,1,"Kim Jong Un Look-Alike Gets Booted From Olympics, Says Face Is 'Too Political'","""I was born with this face, I’ve got to live with it."""
500,4,NY Times Abruptly Fires Its New Nazi-Befriending Editorial Board Hire,"Quinn Norton has tweeted that she's friends with neo-Nazis, and has used slurs on a regular basis."
501,4,Former Employee Sues Vice Media For Allegedly Underpaying Female Staffers,"The plaintiff says she was paid $25,000 less than a male subordinate she hired."
502,4,"Sean Hannity Tweets, Then Deletes, Weirdly Specific Sexual Stuff About Obama Portrait","Fox News host's post claimed there was something hidden in the image, then he quickly backtracked."
503,1,Japanese Short Track Skater Disqualified After Failing Doping Test,Doping cases are rare among Japanese athletes and this is the first for the country at a Winter Olympics.
504,1,Statue Of Liberty Hockey Masks May Be Too 'Political' For Winter Olympics,Goalies on the U.S. women's ice hockey team may need to ditch the masks because of IOC guidelines.
505,1,"Former MLB All-Star Esteban Loaiza Nabbed In $500,000 Cocaine Bust",Police said they found 44 pounds of suspected cocaine in the retired pitcher's rented California home.
506,1,Pity The Fools Who Don't Love Mr. T's Inspirational Olympics Tweets,"""You heard me, curling Fool!"""
507,4,Wall Street Journal's Chloe Kim Joke Falls Flat,"The newspaper said the 17-year-old gold medalist was ""better"" at tweeting than snowboarding."
508,1,Video Expertly Sums Up Why Triple Axel Figure Skating Jump Is So Huge,"“The triple axel is a physics problem."""
509,4,Joe Scarborough Says Trump Made Rob Porter 'The Victim' In Domestic Abuse Allegations,The president sympathized with the White House staff secretary who recently resigned.
510,1,Shaun White Is Damn Near Perfect In His Winter Olympics Comeback,The two-time gold medalist notched a spectacular score in halfpipe and is on his way to the final.
511,1,A Young Adam Rippon Dreams Of Olympic Glory In Adorable Throwback Video,"“All the little things that your coach tells you, you always have to remember them."""
512,1,Chloe Kim Said She Was 'Hangry' Before Her Gold Medal Victory Run,The 17-year-old snowboarder tweeted mid-competition about her unfinished breakfast sandwich.
513,4,New York Times CEO Says Print Edition Might Live Another 10 Years,Mornings of fighting over sections of the paper are coming to an end.
514,1,Chloe Kim Takes Gold For U.S. In Women's Snowboard Halfpipe,The 17-year-old wins with a near-perfect 98.25 score.
515,1,Maame Biney Is Now Down To Her Last Shot In The Winter Olympics,The first black woman on U.S. Olympic short-track team knocked out of 500-meter event.
516,4,"'Fox & Friends' Host Grills Raj Shah, Says 'You Got Burned' For Hiring Porter","""You had a two-time accused domestic abuser there at a very sensitive position where perhaps he shouldn’t have been had that been fully exposed. So what changes now?”"
517,4,Local News Station Runs Graphic Confusing ‘Pyeongchang 2018’ With ‘P.F. Chang 2018’,"A spokesperson apologized for the ""mix-up."""
518,1,Olympic Ski Champion's Epic Wipeout Makes The Media Eat Snow Too,Austrian Matthias Mayer wasn't the only one who went flying.
519,1,Olympic Skier Fabian Bosch Catches Sweet Hang Time In Viral Escalator Stunt,"Give him gold, already!"
520,1,Adam Rippon And Mirai Nagasu's Matching Tattoos Are Our Ultimate BFF Goal,Adam Rippon and Mirai Nagasu share a special bond. It’s about more than just being Olympians. It’s about more than their
521,1,Chloe Kim’s Dad Celebrates The ‘American Dream’ After 17-Year-Old’s Gold Medal Win,Kim Jong-jin quit his job a decade ago to support his daughter’s budding snowboarding career.
522,1,U.S. Luger Emily Sweeney Wipes Out In Dramatic Olympics Crash,The athlete was reportedly taken to a hospital for evaluation.
523,1,Tongan Flag-Bearer Is Worried Sick At Winter Olympics,Pita Taufatofua hasn't heard from his family after a tropical cyclone smashed his homeland.
524,1,Ban The United States From The Olympics,The U.S. Olympic Committee enabled systemic sexual abuse in order to win medals. By what moral logic is that not worse than Russia's crimes?
525,1,Olympic Snowboarder Protests Meek Mill's Imprisonment In Unusual Way,Tit Stante got the message out during the men's halfpipe.
526,1,Figure Skater Mirai Nagasu Becomes First U.S. Woman To Land Triple Axel At Olympics,Nailed it!
527,1,Russian Rival Offered To Lend Luge To Struggling U.S. Silver Medalist,"""I guess this goes against every U.S.-Russian stereotype ever,"" Chris Mazdzer said."
528,1,"Mirai Nagasu Inspired By Michelle Kwan, Also A Child Of Asian Restaurant Family",They both know what it's like growing up with immigrant parents seeking the American Dream.
529,1,Jamie Anderson Of U.S. Wins Gold Medal Again In Winter Olympics Slopestyle,The wind proved to be the toughest competition.
530,1,Olympics Officials Confirm Opening Ceremony Hit By Cyberattack,Russia denied responsibility days before the games began.
531,1,"Team USA Wows With Historic Performances, Wins Bronze In Figure Skating Team Event",Canada captured the gold medal and the Olympic Athletes from Russia team clinched the silver.
532,1,NBC Commentator Whose Insensitive Japan Comments Sparked Furor Is Done Covering Olympics,Joshua Ramo infuriated Koreans and others with comments about Japan and Korea's history that viewers said glossed over the two nations' troubled past.
533,4,GOP Lawmaker Devin Nunes Reportedly Made His Own Fake News Website,"""News, sports and analysis"" website is paid for by the Nunes campaign."
534,4,Katie Couric Is Skating On Thin Ice With Dutch Olympics Fans,Her comments about speed skating aren't going over well.
535,1,The Best Comeback Story At Westminster Dog Show Sadly Ends On Day One,Fanucci the German shepherd recovered from a shattered leg.
536,1,Judges Slammed For Ranking Adam Rippon Third Place Despite Flawless Performance,"""Oh no."""
537,1,Adam Rippon Says He Wanted 'Xanax And A Quick Drink' On The Ice,The U.S. figure skater joked about defeating nerves after his impressive Winter Olympics debut.
538,1,Adam Rippon Just Wanted To Make Reese Witherspoon Proud… And He Did,The Olympic figure skater and the “Big Little Lies” actress are fans of each other’s work.
539,1,Michelle Kwan Tweets Video Proving She's Still A Beast On The Ice,She looks as graceful as ever.
540,1,All The Funny Faces You Need To See From The Olympics' Figure Skating Events,These looks deserve their own medals.
541,3,Instagram May Start Ratting On You If You Screenshot Someone's Story,"This is Insta-tattling, plain and simple."
542,1,Olympic Snowboarding Coach Keeps Calm During Competition In Most Low Key Way,"""Someone please find out what this man is making!!!"""
543,1,U.S. Women's Hockey Team Survives A Scare At Winter Olympics,The Americans had their hands full with Finland in their opener.
544,1,Russian Athlete Dedicates Olympic Medal To ‘Unfairly’ Banned Compatriots,Speed skater Semen Elistratov is reportedly under investigation by the IOC for his comments.
545,4,Tweeters Criticize CNN Over 'Propaganda' Piece On Kim Jong Un's Sister,"""Someone tell CNN that their site has been hacked by the North Korean propaganda ministry,"" tweeted Russian chess legend Garry Kasparov."
546,1,"Canadian Snowboarder Wins Olympic Bronze, 11 Months After Near-Fatal Crash","“It feels pretty special to stand on this podium again after everything,"" said Mark McMorris."
547,4,Boston Radio Host Suspended After Using Fake Asian Accent To Mock Tom Brady's Agent,"Former Patriots player Christian Fauria apologizes for ""insensitive"" impersonation of Don Yee."
548,1,17-Year-Old Snowboarder Wins United States’ First Gold Medal In Pyeongchang,"“I haven’t had time for it to sink in yet,"" Redmond Gerard said following his victory."
549,1,An American Man Actually Won A Luge Medal At The Olympics,"In a first for U.S. men, Chris Mazdzer takes home silver."
550,1,Olympic Speed Skating Photo Finish Is Almost Too Close To Call,Just 0.002 of a second separated the rivals.
551,1,U.S. Figure Skater Adam Rippon Unimpressed By 'Generic' Olympic Condoms,More condoms will be distributed at the Pyeongchang Games than at any previous Winter Olympics.
552,1,U.S. 'Shib Sibs' Win Over The World In 2018 Winter Olympics Debut,Brother and sister Alex and Maia Shibutani took second in the team event short dance.
553,1,Olympics Figure Skater Yura Min Overcomes Wardrobe Malfunction With Calm And Class,"Min, skating for South Korea, completed her short dance routine on Sunday despite a precarious outfit situation."
554,3,Winter Olympics Organizers Probe Possible Cyberattack On Opening Ceremony Day,All competitions are running as planned as officials continue to investigate a disruption of non-critical systems.
555,1,First Black Woman On U.S. Olympic Speedskating Team Advances In Games Debut,"Maame Biney, just 18, brilliantly held off a charging opponent in her first race."
556,1,Reigning Gold Medalist Drops Out Of Winter Olympics After Brain Injury,Sochi halfpipe champ Iouri Podladtchikov crashed during a recent X Games event.
557,1,And The First Gold Medal Of The Winter Olympics Goes To ...,Skiathlon victor took silver at the previous Games.
558,1,"Johnny Weir Says He's A Commentator, Not A 'Complimentator'",NBC's Olympic figure skating analyst explained his unvarnished talk about the competitors.
559,4,"Newsweek Brings Back Accused Sexual Harasser As Staffers, Advertisers Flee",Staffers' terrible week somehow ended even worse than it started.
560,1,Court Denies Final Attempt By Russian Athletes To Compete In Winter Olympics,The Russians had appealed their exclusion from the games over the doping scandal from the 2014 Sochi Games.
561,3,Google Kicks Off Winter Olympics With Vibrant 'Snow Games' Doodle,Who knew dogs could ski-jump?
562,1,South Korean President Shakes Hands With North Korean Leaders During Winter Olympics Opening Ceremony,It was a historic moment for the two warring nations.
563,1,Read Live Updates On The 2018 Olympic Opening Ceremony,Let the games begin.
564,1,Here's Maybe The Definitive Way To Pronounce 'Pyeongchang',"Now that the 2018 Winter Olympics have started, it's time you learned."
565,3,Facebook Reportedly Beta-Testing 'Downvote' Button,Selected users now have the option to flag posts to Facebook.
566,1,Olympic Skier Lindsey Vonn Gives Tearful Interview About Late Grandfather,"""I’m gonna win for him.”"
567,1,This Winter Olympics Walkie-Talkie Save Is Comedy Gold,"You're safe now, lil' gadget."
568,1,U.S. Bobsled Team Pays Tribute To Late Gold Medalist Steven Holcomb,"“We’re all suffering together and the best way to honor Holcomb’s legacy is to carry it on."""
569,1,"The 2018 Winter Olympics In Pyeongchang, By The Numbers",This year's games are bigger than ever.
570,1,This Ex-NFL Player Is On A Mission To Become A Chess Master,"Having mastered football and math, John Urschel has his sights on chess."
571,1,Shirtless Tonga Olympian Pita Taufatofua Wins Olympic Opening Ceremony Again,The Winter Games warmed up real quick!
572,1,Mother Of Pittsburgh Pirates Catcher Elias Diaz Kidnapped In Venezuela,Details about Ana Soto's disappearance have not been released but the Pirates issued a statement confirming she was in danger.
573,1,Speed Skater Shani Davis: Team USA Chose Olympics Flag-Bearer ‘Dishonorably’,He lost out to luge veteran Erin Hamlin in a coin toss.
574,1,The Most Dazzling Moments From The 2018 Winter Olympics Opening Ceremony,The 2018 Winter Games are officially open.
575,1,U.S. Men's Olympic Hockey Team Includes First Black Player In 98-Year History,"“I just think I’m another kid going to play in the Olympics."""
576,2,"Uber, Waymo Reach Settlement In Bitter Legal Dispute",Uber had been accused of stealing trade secrets from Waymo.
577,1,Athletes To Watch At The 2018 Winter Olympics In Pyeongchang,A lot of them are women.
578,4,"Fox News Exec Wants Team USA To Stop Celebrating Being ‘Darker, Gayer, Different’",The network's executive editor laments U.S. Olympics' highlighting of its diverse group of athletes.
579,1,South Korea's Olympic Stadium Will Host Just 4 Events Before It's Torn Down,That's funny because the Pyeongchang Games were meant to be the financially prudent ones.
580,1,"Johnny Weir, Tara Lipinski Throw Enough Olympic Shade To Keep The Ice Frozen",...and people are loving every snide minute of it.
581,1,The Day The NBA Wrapped Itself Around LeBron’s Finger,An inarguably way-too-in-depth diary of a bonkers NBA trade deadline.
582,2,"72 Percent Of Asian-American Elders, Their Families Targeted By Fraud: Report","Limited English proficiency could be one reason why, the study suggests."
583,2,"Wall Street Turmoil Worsens As Dow Jones Plunges 1,000 Points",The benchmark S&P 500 and the Dow industrials confirmed they were in correction territory.
584,1,"15,000 Eggs Delivered To Norwegian Olympic Team After Google Translate Error",Oops.
585,1,Olympic Curler Matt Hamilton Has A Super Doppelgänger,Wahoo!
586,4,Jake Tapper: Trump Presidency Once Again Eroding Basic Lines Of Human Decency,"The White House has become ""a place where our national standards are being degraded,"" he said."
587,4,CNN Host Tells Holocaust-Denying Congress Candidate: 'You'll Go Down In Flames',“It is shocking to hear how vocally and unapologetically racist you are. Are you a Nazi?” asked Alisyn Camerota.
588,1,Brother And Sister Curling Team Hope To Sweep Their Way To Olympic Gold,"Matt and Becca Hamilton say curling is a mix of shuffleboard, chess, bowling and Swiffering your floor."
589,1,Kevin Durant Slam-Dunking In Super Slow Motion Is A Thing Of Real Beauty,It's as if the Golden State Warriors star is walking on air.
590,2,Steve Wynn Out As CEO And Chairman Of Wynn Resorts,The Las Vegas mogul has been accused of abusing and sexually harassing casino workers for decades.
591,4,Tronc Is Keeping Ross Levinsohn Aboard After Probe Into 'Frat House' Behavior,"An independent investigation found ""no wrongdoing,"" the company said."
592,2,Solar Jobs Fell For The First Time In 7 Years In 2017. Now Trump Could Make It Worse.,The new tariffs the White House announced last month are likely to make things worse for the industry.
593,4,Watch GOP Memo Author Devin Nunes Flee From A Simple Question,The California congressman bolts when asked about his anti-FBI memo .
594,1,Former U.S. Olympic Coach Under Criminal Investigation Amid Larry Nassar Scandal,John Geddert has been accused by multiple Nassar victims of being physically and verbally abusive to his athletes.
595,1,Steelers Linebacker Hurt In Head-On Tackle Stands For Pittsburgh Crowd,"Ryan Shazier, who couldn't move his legs after a severe spinal injury in December, saluted fans at a Penguins game."
596,2,Asian Markets Take A Tumble After U.S. Stocks Decline,Asian shares fell sharply on Tuesday after Wall Street suffered its biggest decline since 2011.
597,1,Rob Gronkowski's House Burglarized While Patriots Were At Super Bowl,"""Multiple safes and possible guns taken."""
598,1,Norovirus Outbreak At Winter Olympics Prompts Military Response,"Troops will replace hundreds of civilian security guards until they're determined to be ""well."""
599,4,Tronc Sold The Los Angeles Times To Billionaire Patrick Soon-Shiong,The sale comes amid turbulence between Tronc and Times staffers.
600,2,Wall Street Bounces Back In Day Of Volatile Trade,"The Dow Jones Industrial Average rose 567.02 points, or 2.33 percent, to 24,912.77."
601,1,Philadelphia Schools To Close So Kids Can 'Witness History' At Super Bowl Parade,"School officials called it ""a once in a lifetime event."""
602,4,Yup. Sean Hannity Found A Way To Blame Obama For The Stock Market Drop,"He also claimed the slide is ""a sign of strength more than anything else."""
603,4,"Pro-Trump Ad In Times Square Condemns 'Fake News,' Pushes Attack On Clinton",The super PAC that paid for it used to be called Stop Hillary PAC.
604,1,Indianapolis Colts' Edwin Jackson Killed By Suspected Drunk Driver,Jackson and his Uber driver were struck on the side of an interstate highway in Indiana.
605,1,"'Philly Special,' And How Doug Pederson Out-Coached Bill Belichick In The Super Bowl",Pederson put his foot on the gas when the season started and never let up.
606,1,The Rise Of Nick Foles: How A Journeyman QB Became A Super Bowl Hero,Foles outdueled Tom Brady in one of the wildest Super Bowls ever.
607,1,My Cartoon Diary Of The Super Bowl,"Football, commercials, Timberlake and Proust."
608,1,Rob Gronkowski Doesn't Flinch At Mention of 'Retirement',"""I'm definitely going to look at my future, for sure."""
609,1,Behind The Black Curtain With Tom Brady: Tears And Concerns Over Patriots’ Dynasty,"After one of the toughest losses of his career, the Patriots' Tom Brady stepped behind a black curtain and dropped down as his wife and kids closed around him."
610,1,Philadelphia Eagles Beat New England Patriots For First Super Bowl Win,"In the wildest shootout in Super Bowl history, Nick Foles outdueled Tom Brady to defeat the New England Patriots, 41-33."
611,2,Budweiser Touts Disaster Relief Efforts In 2018 Super Bowl Ad,The minute-long commercial highlights the company's emergency response plans.
612,1,Patriots QB Tom Brady After Super Bowl Loss: 'I Expect To Be Back',New England Patriots’ 40-year-old quarterback is not ready to retire.
613,1,This Kid Looking At His Phone Is The Super Bowl's Best Meme,We've all been there.
614,1,"South Korea Reportedly Bans 36,000 Foreigners From Attending The Olympics",Security is going to be tough at the Winter Games this year.
615,1,Wild Scene In Philadelphia After Eagles Win Super Bowl,Three people were arrested during the rowdy celebrations.
616,1,Several Eagles Players Already Planning To Skip White House Visit,"At least three players say they won't go, if invited."
617,1,Gisele Bündchen Has A Word With Eagles Players After Super Bowl,The supermodel wife of Patriots quarterback Tom Brady encountered victorious Philadelphia players in a stadium hallway.
618,1,Here Are 10 Photos Of Tom Brady Dropping A Pass During The Super Bowl,Go Pats.
619,2,"Dow Plunges Nearly 1,600 Points In Biggest Intraday Point Drop In History",The drop came as investors grappled with rising bond yields and potentially firming inflation.
620,4,Newsweek's Top Editor And Staffers Suddenly Fired,Staffers suspect the firings may be retaliation for investigations into their own parent company.
621,1,Larry Nassar Sentenced To 40 To 125 Years On 3 Additional Child Sexual Abuse Charges,He's already been sentenced to 40 to 175 years on other abuse charges.
622,1,"After An NFL Season Defined By Black Protest, The Super Bowl Sticks To Sports","Agitation is taking a knee, and the league couldn't be happier."
623,1,TODAY: The Dynasty vs. The Underdogs,The New England Patriots will take on the Philadelphia Eagles in Super Bowl LII.
624,1,Super Bowl LII: Live Updates From Patriots vs. Eagles Game,Watch along with us!
625,1,Flight Attendant Told Eagles Fans To 'Tone It Down' -- They Didn't,These fans are flying high.
626,1,All The Amusing #WinterOlympicsTV Shows You Need For Pyeongchang 2018,"""Stranger Rinks,"" anyone?"
627,1,Nassar Reportedly Abused Over 2 Dozen Girls And Women During Sluggish FBI Investigation,The now-convicted doctor Larry Nassar continued to practice for over a year after serious accusations arose.
628,2,Fed Lowers The Boom On Wells Fargo After Years Of Grotesque Scandals,"In an unprecedented move, the Fed ordered the bank to halt growth over compliance issues."
629,1,These Pups Rescued From Puerto Rico Are Part Of This Year's Puppy Bowl,The two dogs are among those flown off the island in the wake of Hurricane Maria.
630,2,Steve Wynn's $7.5 Million Settlement Reportedly Involved Paternity Claim,Dozens of former employees have accused the casino mogul of sexual harassment.
631,1,Outside Law Firm To Probe U.S. Olympics And Gymnastics Officials Over Larry Nassar Scandal,Independent investigators are scrutinizing the institutions that survivors and their families say knew about his abuse but tried to cover it up.
632,4,Signs Of Sexual Harassment At NY Daily News Were Right There On The Page,"“I was like, ‘Holy shit. This is how it is in news, and it is not for me.’”"
633,4,Sean Hannity's Pee Pee Tape Discussion Goes Completely Off The Rails,Erm...
634,1,Olympic Doping Bans On 28 Russian Athletes Overturned By Sport's Highest Tribunal,Their results from the 2014 Winter Games in Sochi were also reinstated.
635,1,"Isaiah Canaan's Ankle Injury Is So Horrible, Fellow Players Can't Look",Isaiah Canaan suffered a season-ending fracture that will linger in your head for a while.
636,2,Trump’s USDA Could Make Hog Workers’ Jobs Even More Dangerous,The government agency proposed a rule that would eliminate line speed maximums at hog plants.
637,4,Top Editors Out At NY Daily News Following Harassment Investigations,"The newspaper's managing editor fostered a culture of fear and silence, current and former staffers said."
638,4,Mika Brzezinski Shuts Down Michael Wolff Interview During Spat Over Nikki Haley Rumors,"The ""Morning Joe"" co-host called the author's behavior ""disgraceful."""
639,1,Former USA Gymnastics Doctor Larry Nassar Has 'Over 265 Identified Victims',Nassar's sentencing hearing for additional charges of child sexual abuse began Wednesday.
640,4,Tomi Lahren Apologizes For 'Limp Dick' Social Media Meltdown,The conservative commentator attacked Rep. Joe Kennedy III on Instagram.
641,2,"USDA Spares Poultry Workers Faster Line Speeds, But Hog Workers May Not Get So Lucky","Activists celebrated the decision, but remain concerned about the welfare of workers in hog plants."
642,4,Van Jones Tears Apart Trump's Speech: 'Sweet-Tasting Candy With Poison In It',The CNN commentator calls out the president's rhetoric.
643,4,Internet Burns Washington Post Over Its Front Page On Trump's Speech,People are not happy at all.
644,2,Monster Energy Vice President Accused Of Sexual Harassment Resigns,"HuffPost's reporting revealed text messages in which he called a female employee a ""whore."""
645,4,Trump's State Of The Union Gets Brutal Review From New York Daily News,Trump won't like his hometown newspaper's take on the speech.
646,1,Tom Brady Has This Wish For Radio Host Who Insulted His 5-Year-Old Daughter,The Patriots quarterback addressed the situation at a Super Bowl press conference.
647,3,"Elon Musk Says He's Sold 10,000 Flamethrowers Through His Boring Co. Website",“World’s safest flamethrower!”
648,1,Aly Raisman Thinks 175 Years For Larry Nassar Is ‘Not Enough’,"The Olympic gymnast said she hopes the serial predator's prison sentence sets an ""example to all the other abusers out there that their time is up."""
649,3,Facebook Pledges To Add More Local News To Newsfeeds,"""People who know what’s happening around them are more likely to get involved and help make a difference,"" said CEO Mark Zuckerberg."
650,4,Reuters Editor Landed At Newsweek Despite Sexual Harassment Claim: Report,"Dayan Candappa, now on leave, was accused of pressuring a female subordinate for 10 months at Reuters."
